{"attributes":{"describeUrl":"/services/data/v29.0/analytics/reports/00Oa0000008sXV1EAM/describe","instancesUrl":"/services/data/v29.0/analytics/reports/00Oa0000008sXV1EAM/instances","reportId":"00Oa0000008sXV1EAM","reportName":"Deals Booked This Quarter_Global","type":"Report"},"allData":true,"factMap":{"T!T":{"aggregates":[{"label":"212","value":212}],"rows":[{"dataCells":[{"label":"813072","value":"813072"},{"label":"LA","value":"LA"},{"label":"BRAZIL","value":"BRAZIL"},{"label":"BRAZIL - FEDERAL","value":"BRAZIL - FEDERAL"},{"label":"BRAZIL - FEDERAL","value":"BRAZIL - FEDERAL"},{"label":"BR - BRAZIL","value":"BR - BRAZIL"},{"label":"MUCFA01","value":"00530000004PHDmAAO"},{"label":"Fabio Mucci","value":"Fabio Mucci"},{"label":"Banco do Brasil - MAA + APM Capacity","value":"006a000001EI8TBAA1"},{"label":"Banco do Brasil (Cassi, Previ, Brasilcap, Brasilprev, Cobra)","value":"0013000000HQXUcAAP"},{"label":"USD 4,306,976.62","value":{"amount":4306976.61521821767483130170344053983455,"currency":"USD"}},{"label":"MUCFA01","value":"00530000004PHDmAAO"},{"label":"Fabio Mucci","value":"00530000004PHDmAAO"},{"label":"Eduardo Pedrinha Carlos","value":"005a000000AwhxXAAR"},{"label":"100% - Contract Signed","value":"100% - Contract Signed"},{"label":"PNCV w/Services & Education","value":"PNCV w/Services & Education"},{"label":"Enterprise Management","value":"Enterprise Management"},{"label":"10/17/2016","value":"2016-10-17"}]},{"dataCells":[{"label":"877163","value":"877163"},{"label":"NA","value":"NA"},{"label":"Named/Growth","value":"Named/Growth"},{"label":"NG_NORTH","value":"NG_NORTH"},{"label":"NG_NORTH_NAMED","value":"NG_NORTH_NAMED"},{"label":"US - UNITED STATES","value":"US - UNITED STATES"},{"label":"DASEF01","value":"005300000017RqbAAE"},{"label":"Efprepios Daskalakis","value":"Efprepios Daskalakis"},{"label":"USCC- SV Upgrade","value":"006a000001JP8qsAAD"},{"label":"Telephone and Data Systems, Inc.","value":"0013000000HQY85AAH"},{"label":"USD 957,366.58","value":{"amount":957366.58,"currency":"USD"}},{"label":"LEWST04","value":"00530000000whAYAAY"},{"label":"Steve Lewison","value":"00530000000whAYAAY"},{"label":"Jeffrey Liebl","value":"005a000000BzqTZAAZ"},{"label":"100% - Contract Signed","value":"100% - Contract Signed"},{"label":"Renewal w/Products","value":"Renewal w/Products"},{"label":"Continuous Delivery","value":"Continuous Delivery"},{"label":"10/10/2016","value":"2016-10-10"}]},{"dataCells":[{"label":"905905","value":"905905"},{"label":"APJ","value":"APJ"},{"label":"INDIA","value":"INDIA"},{"label":"INDIA","value":"INDIA"},{"label":"INDIA","value":"INDIA"},{"label":"IN - INDIA","value":"IN - INDIA"},{"label":"SHARA23","value":"005a0000007ozznAAA"},{"label":"Ravi Sharma","value":"Ravi Sharma"},{"label":"GSTN Maintenance","value":"006a000001LMGufAAH"},{"label":"MINISTRY OF FINANCE AND DISINVESTMENT","value":"00130000014MfKtAAK"},{"label":"USD 861,059.52","value":{"amount":861059.5234878866190334670112374725484944,"currency":"USD"}},{"label":"SHARA23","value":"005a0000007ozznAAA"},{"label":"Ravi Sharma","value":"005a0000007ozznAAA"},{"label":"Akash Suri","value":"00530000000wkzLAAQ"},{"label":"100% - Contract Signed","value":"100% - Contract Signed"},{"label":"PNCV","value":"PNCV"},{"label":"Security","value":"Security"},{"label":"10/17/2016","value":"2016-10-17"}]},{"dataCells":[{"label":"833041","value":"833041"},{"label":"APJ","value":"APJ"},{"label":"ANZ","value":"ANZ"},{"label":"AUSTRALIA","value":"AUSTRALIA"},{"label":"AUSTRALIA","value":"AUSTRALIA"},{"label":"AU - AUSTRALIA","value":"AU - AUSTRALIA"},{"label":"GAWAJ02","value":"005a0000009dCfgAAE"},{"label":"Ajay Gawande","value":"Ajay Gawande"},{"label":"Optus API","value":"006a000001G3tWvAAJ"},{"label":"OPTUS","value":"0013000000HRMdMAAX"},{"label":"USD 405,789.61","value":{"amount":405789.6062450155083538003986180600459873,"currency":"USD"}},{"label":"GAWAJ02","value":"005a0000009dCfgAAE"},{"label":"Ajay Gawande","value":"005a0000009dCfgAAE"},{"label":"Ivan Lobo","value":"0053000000533lAAAQ"},{"label":"100% - Contract Signed","value":"100% - Contract Signed"},{"label":"PNCV w/Services & Education","value":"PNCV w/Services & Education"},{"label":"API Management","value":"API Management"},{"label":"10/13/2016","value":"2016-10-13"}]},{"dataCells":[{"label":"882520","value":"882520"},{"label":"NA","value":"NA"},{"label":"Platinum","value":"Platinum"},{"label":"PLAT_SE","value":"PLAT_SE"},{"label":"PLAT_SE_ATLANTA","value":"PLAT_SE_ATLANTA"},{"label":"US - UNITED STATES","value":"US - UNITED STATES"},{"label":"MITWI04","value":"00530000001teY5AAI"},{"label":"William Mitts","value":"William Mitts"},{"label":"Elavon_PAM PhaseI","value":"006a000001JRDUmAAP"},{"label":"ELAVON","value":"0013000000HQXzOAAX"},{"label":"USD 387,200.00","value":{"amount":387200,"currency":"USD"}},{"label":"BELRI05","value":"00530000001srvmAAA"},{"label":"Rion Bellotti","value":"00530000001srvmAAA"},{"label":"Michael Molloy","value":"00530000000whJgAAI"},{"label":"100% - Contract Signed","value":"100% - Contract Signed"},{"label":"PNCV","value":"PNCV"},{"label":"Security","value":"Security"},{"label":"10/6/2016","value":"2016-10-06"}]},{"dataCells":[{"label":"891357","value":"891357"},{"label":"EMEA","value":"EMEA"},{"label":"UKI","value":"UKI"},{"label":"UKI","value":"UKI"},{"label":"UK","value":"UK"},{"label":"GB - UNITED KINGDOM","value":"GB - UNITED KINGDOM"},{"label":"SPAJA03","value":"005a000000Co3TEAAZ"},{"label":"James Spafford","value":"James Spafford"},{"label":"HSBC TDM SNCV","value":"006a000001KH8TOAA1"},{"label":"HSBC HOLDINGS PLC","value":"0013000000HabxLAAR"},{"label":"USD 373,154.00","value":{"amount":373154,"currency":"USD"}},{"label":"HEAGA01","value":"005a000000BE7fUAAT"},{"label":"Gareth Heaton","value":"005a000000BE7fUAAT"},{"label":"Timothy Reynolds","value":"00530000005SWuvAAG"},{"label":"100% - Contract Signed","value":"100% - Contract Signed"},{"label":"Services w/Education","value":"Services w/Education"},{"label":"Continuous Delivery","value":"Continuous Delivery"},{"label":"10/6/2016","value":"2016-10-06"}]},{"dataCells":[{"label":"849218","value":"849218"},{"label":"EMEA","value":"EMEA"},{"label":"UKI","value":"UKI"},{"label":"UKI","value":"UKI"},{"label":"UK","value":"UK"},{"label":"GB - UNITED KINGDOM","value":"GB - UNITED KINGDOM"},{"label":"DALGR02","value":"005a000000Ck2IHAAZ"},{"label":"Gregg Daly","value":"Gregg Daly"},{"label":"DVLA - Gen Extended Support","value":"006a000001GnobOAAR"},{"label":"Department For Transport","value":"0013000000HacI8AAJ"},{"label":"USD 359,000.00","value":{"amount":359000.0000430800000051696000006203520001,"currency":"USD"}},{"label":"DALGR02","value":"005a000000Ck2IHAAZ"},{"label":"Gregg Daly","value":"005a000000Ck2IHAAZ"},{"label":"Kieran O'Driscoll","value":"005a000000BoKwIAAV"},{"label":"100% - Contract Signed","value":"100% - Contract Signed"},{"label":"Support","value":"Support"},{"label":"Mainframe","value":"Mainframe"},{"label":"10/3/2016","value":"2016-10-03"}]},{"dataCells":[{"label":"879593","value":"879593"},{"label":"APJ","value":"APJ"},{"label":"JAPAN","value":"JAPAN"},{"label":"JAPAN","value":"JAPAN"},{"label":"JAPAN","value":"JAPAN"},{"label":"JP - JAPAN","value":"JP - JAPAN"},{"label":"SHIYA01","value":"00530000003o5hTAAQ"},{"label":"Yasunori Shinomiya","value":"Yasunori Shinomiya"},{"label":"DIRECT-MEIJI-RC_Migrator+DB_PLAN-Analyzer","value":"006a000001JQJoSAAX"},{"label":"MEIJI HOLDINGS CO., LTD.","value":"001a000001J6YpQAAV"},{"label":"USD 355,200.00","value":{"amount":355200.0000397824000044556288004990304257,"currency":"USD"}},{"label":"SHIYA01","value":"00530000003o5hTAAQ"},{"label":"Yasunori Shinomiya","value":"00530000003o5hTAAQ"},{"label":"Takehiro Inoue","value":"005300000017Q7sAAE"},{"label":"100% - Contract Signed","value":"100% - Contract Signed"},{"label":"Renewal w/Products","value":"Renewal w/Products"},{"label":"Mainframe","value":"Mainframe"},{"label":"10/1/2016","value":"2016-10-01"}]},{"dataCells":[{"label":"888135","value":"888135"},{"label":"NA","value":"NA"},{"label":"Public Sector/Canada","value":"Public Sector/Canada"},{"label":"PS_FED/FSI","value":"PS_FED/FSI"},{"label":"PS_HEALTH","value":"PS_HEALTH"},{"label":"US - UNITED STATES","value":"US - UNITED STATES"},{"label":"TOMNA01","value":"00530000000whCmAAI"},{"label":"Nancy Tome","value":"Nancy Tome"},{"label":"SSA Call Order 15 - OIS Security Services","value":"006a000001KGa8jAAD"},{"label":"SOCIAL SECURITY ADMINISTRATION","value":"0013000000HQYFPAA5"},{"label":"USD 353,955.00","value":{"amount":353955,"currency":"USD"}},{"label":"TOMNA01","value":"00530000000whCmAAI"},{"label":"Nancy Tome","value":"00530000000whCmAAI"},{"label":"Mark Jones","value":"00530000000whD1AAI"},{"label":"100% - Contract Signed","value":"100% - Contract Signed"},{"label":"Services","value":"Services"},{"label":"Security","value":"Security"},{"label":"10/3/2016","value":"2016-10-03"}]},{"dataCells":[{"label":"883073","value":"883073"},{"label":"NA","value":"NA"},{"label":"Platinum","value":"Platinum"},{"label":"PLAT_CENTRAL","value":"PLAT_CENTRAL"},{"label":"PLAT_CENTRAL_MIDWEST","value":"PLAT_CENTRAL_MIDWEST"},{"label":"US - UNITED STATES","value":"US - UNITED STATES"},{"label":"OLSEL02","value":"00530000001qH4MAAU"},{"label":"Elizabeth Olson","value":"Elizabeth Olson"},{"label":"NM - ELA Capacity","value":"006a000001JRW3AAAX"},{"label":"Northwestern Mutual Life","value":"0013000000HQXzKAAX"},{"label":"USD 293,474.00","value":{"amount":293474,"currency":"USD"}},{"label":"OLSEL02","value":"00530000001qH4MAAU"},{"label":"Elizabeth Olson","value":"00530000001qH4MAAU"},{"label":"Nona Schwabe","value":"00530000003oNyvAAE"},{"label":"100% - Contract Signed","value":"100% - Contract Signed"},{"label":"PNCV w/Services","value":"PNCV w/Services"},{"label":"Enterprise Management","value":"Enterprise Management"},{"label":"10/5/2016","value":"2016-10-05"}]},{"dataCells":[{"label":"882620","value":"882620"},{"label":"EMEA","value":"EMEA"},{"label":"FRA","value":"FRA"},{"label":"FRANCE","value":"FRANCE"},{"label":"FRANCE","value":"FRANCE"},{"label":"FR - FRANCE","value":"FR - FRANCE"},{"label":"HUGST06","value":"005a000000B69VkAAJ"},{"label":"Stephane Hugaud","value":"Stephane Hugaud"},{"label":"BPCE SA - Mise en oeuvre CA PPM","value":"006a000001JRGTJAA5"},{"label":"GROUPE BPCE","value":"0013000000HabwpAAB"},{"label":"USD 238,024.08","value":{"amount":238024.0800390359491264018956567299108877,"currency":"USD"}},{"label":"DAICH03","value":"005a0000007oCYIAA2"},{"label":"Christophe Daignes","value":"005a0000007oCYIAA2"},{"label":"Timothy Smithson","value":"005a000000BDpztAAD"},{"label":"100% - Contract Signed","value":"100% - Contract Signed"},{"label":"Services","value":"Services"},{"label":"PPM","value":"PPM"},{"label":"10/7/2016","value":"2016-10-07"}]},{"dataCells":[{"label":"871071","value":"871071"},{"label":"EMEA","value":"EMEA"},{"label":"CEN","value":"CEN"},{"label":"SWITZERLAND","value":"SWITZERLAND"},{"label":"SWITZERLAND","value":"SWITZERLAND"},{"label":"CH - SWITZERLAND","value":"CH - SWITZERLAND"},{"label":"Gowner","value":"00530000006ca0qAAA"},{"label":"Generic Owner","value":"Generic Owner"},{"label":"Acentix / Trivadis Holding AG MT 01 Jan 2017 (Indirect)","value":"006a000001JO3cgAAD"},{"label":"Trivadis Holding AG","value":"001a000001JyGWUAA3"},{"label":"USD 234,007.36","value":{"amount":234007.3585058649289880532938741953101487,"currency":"USD"}},{"label":"PLEJE01","value":"00530000000wiVxAAI"},{"label":"Jeannetta Plesky","value":"00530000000wiVxAAI"},{"label":"Rupert Emmett","value":"00530000000wqVlAAI"},{"label":"100% - Contract Signed","value":"100% - Contract Signed"},{"label":"Renewal w/Products","value":"Renewal w/Products"},{"label":"Enterprise Management","value":"Enterprise Management"},{"label":"10/2/2016","value":"2016-10-02"}]},{"dataCells":[{"label":"848440","value":"848440"},{"label":"EMEA","value":"EMEA"},{"label":"NTH","value":"NTH"},{"label":"BELUX","value":"BELUX"},{"label":"BELGIUM","value":"BELGIUM"},{"label":"BE - BELGIUM","value":"BE - BELGIUM"},{"label":"Gowner","value":"00530000006ca0qAAA"},{"label":"Generic Owner","value":"Generic Owner"},{"label":"B_ING (NN)_PPM_Lic_FMC","value":"006a000001GnIiYAAV"},{"label":"NN Group N.V.","value":"001a000001dbxwaAAA"},{"label":"USD 226,085.46","value":{"amount":226085.4585970780152099207944944270102971,"currency":"USD"}},{"label":"MILFE01","value":"00530000001bzrjAAA"},{"label":"Felipe Millan Caballero","value":"00530000001bzrjAAA"},{"label":"Steven Moerman","value":"005a000000AKVz0AAH"},{"label":"100% - Contract Signed","value":"100% - Contract Signed"},{"label":"PNCV","value":"PNCV"},{"label":"PPM","value":"PPM"},{"label":"10/7/2016","value":"2016-10-07"}]},{"dataCells":[{"label":"864707","value":"864707"},{"label":"EMEA","value":"EMEA"},{"label":"FRA","value":"FRA"},{"label":"FRANCE","value":"FRANCE"},{"label":"FRANCE","value":"FRANCE"},{"label":"FR - FRANCE","value":"FR - FRANCE"},{"label":"POUFR04","value":"005a000000B69WiAAJ"},{"label":"Frederic Poulain","value":"Frederic Poulain"},{"label":"Orange Caraibes- Projet pilote RA","value":"006a000001IvvxPAAR"},{"label":"ORANGE (FRANCE TELECOM)","value":"0013000000Habv5AAB"},{"label":"USD 213,375.00","value":{"amount":213375.0000349935000057389340009411851762,"currency":"USD"}},{"label":"CHEPI02","value":"00530000000wiFHAAY"},{"label":"Pierre Cheval","value":"00530000000wiFHAAY"},{"label":"Florian Sellem","value":"005a000000BBmv8AAD"},{"label":"100% - Contract Signed","value":"100% - Contract Signed"},{"label":"PNCV","value":"PNCV"},{"label":"Continuous Delivery","value":"Continuous Delivery"},{"label":"10/3/2016","value":"2016-10-03"}]},{"dataCells":[{"label":"668986","value":"668986"},{"label":"NA","value":"NA"},{"label":"Named/Growth","value":"Named/Growth"},{"label":"NG_NORTH","value":"NG_NORTH"},{"label":"NG_NORTH_NAMED","value":"NG_NORTH_NAMED"},{"label":"US - UNITED STATES","value":"US - UNITED STATES"},{"label":"NA_PARTN","value":"00530000006cIIzAAM"},{"label":"NA PARTNER","value":"NA PARTNER"},{"label":"IBM- Mead","value":"006a0000016lWBRAA2"},{"label":"IBM Global Services - West (North America)","value":"001a000001YMXNuAAP"},{"label":"USD 213,116.00","value":{"amount":213116,"currency":"USD"}},{"label":"LACJO02","value":"005300000017Q8QAAU"},{"label":"John LaCorte","value":"005300000017Q8QAAU"},{"label":"Peter Genussa","value":"005300000017Q8IAAU"},{"label":"100% - Contract Signed","value":"100% - Contract Signed"},{"label":"PNCV w/Education","value":"PNCV w/Education"},{"label":"Enterprise Management","value":"Enterprise Management"},{"label":"10/7/2016","value":"2016-10-07"}]},{"dataCells":[{"label":"892833","value":"892833"},{"label":"NA","value":"NA"},{"label":"Platinum","value":"Platinum"},{"label":"PLAT_NE","value":"PLAT_NE"},{"label":"PLAT_NE_GRNY_2","value":"PLAT_NE_GRNY_2"},{"label":"US - UNITED STATES","value":"US - UNITED STATES"},{"label":"SCHKE16","value":"005300000023FH9AAM"},{"label":"Kevin Schaeffer","value":"Kevin Schaeffer"},{"label":"GE Corp - SSO ESS","value":"006a000000zRlTDAA0"},{"label":"General Electric Company","value":"0013000000HQXoTAAX"},{"label":"USD 200,000.00","value":{"amount":200000,"currency":"USD"}},{"label":"SCHKE16","value":"005300000023FH9AAM"},{"label":"Kevin Schaeffer","value":"005300000023FH9AAM"},{"label":"Adam Civalier","value":"00530000000whGjAAI"},{"label":"100% - Contract Signed","value":"100% - Contract Signed"},{"label":"Services","value":"Services"},{"label":"Security","value":"Security"},{"label":"10/11/2016","value":"2016-10-11"}]},{"dataCells":[{"label":"876907","value":"876907"},{"label":"NA","value":"NA"},{"label":"Platinum","value":"Platinum"},{"label":"PLAT_WEST","value":"PLAT_WEST"},{"label":"PLAT_WEST_ROCKIES","value":"PLAT_WEST_ROCKIES"},{"label":"US - UNITED STATES","value":"US - UNITED STATES"},{"label":"NA_PARTN","value":"00530000006cIIzAAM"},{"label":"NA PARTNER","value":"NA PARTNER"},{"label":"GBT SSO - Additional 20K","value":"006a000001JP5CgAAL"},{"label":"Dell Inc.","value":"0013000000Nwk0RAAR"},{"label":"USD 199,500.00","value":{"amount":199500,"currency":"USD"}},{"label":"SHAGA06","value":"00530000001bN98AAE"},{"label":"Gaurav Sharma","value":"00530000001bN98AAE"},{"label":"Brent McDuffie","value":"0053000000234zaAAA"},{"label":"100% - Contract Signed","value":"100% - Contract Signed"},{"label":"PNCV","value":"PNCV"},{"label":"Security","value":"Security"},{"label":"10/7/2016","value":"2016-10-07"}]},{"dataCells":[{"label":"884177","value":"884177"},{"label":"EMEA","value":"EMEA"},{"label":"CEN","value":"CEN"},{"label":"GERMANY","value":"GERMANY"},{"label":"GERMANY","value":"GERMANY"},{"label":"DE - GERMANY","value":"DE - GERMANY"},{"label":"SCHRA18","value":"005a000000Co00dAAB"},{"label":"Ralf Schmidt","value":"Ralf Schmidt"},{"label":"Deutsche Postbank AG_CA PPM_itdesign","value":"006a000001K43yJAAR"},{"label":"DEUTSCHE BANK AG","value":"0013000000HabzfAAB"},{"label":"USD 193,104.94","value":{"amount":193104.9440316692108211937505746757750942,"currency":"USD"}},{"label":"SCHRA18","value":"005a000000Co00dAAB"},{"label":"Ralf Schmidt","value":"005a000000Co00dAAB"},{"label":"Udo Drabke","value":"00530000000wiGIAAY"},{"label":"100% - Contract Signed","value":"100% - Contract Signed"},{"label":"PNCV","value":"PNCV"},{"label":"PPM","value":"PPM"},{"label":"10/11/2016","value":"2016-10-11"}]},{"dataCells":[{"label":"896218","value":"896218"},{"label":"NA","value":"NA"},{"label":"Platinum","value":"Platinum"},{"label":"PLAT_SE","value":"PLAT_SE"},{"label":"PLAT_SE_ATLANTA","value":"PLAT_SE_ATLANTA"},{"label":"US - UNITED STATES","value":"US - UNITED STATES"},{"label":"MITWI04","value":"00530000001teY5AAI"},{"label":"William Mitts","value":"William Mitts"},{"label":"Elavon_PAM Services","value":"006a000000zOVaTAAW"},{"label":"ELAVON","value":"0013000000HQXzOAAX"},{"label":"USD 192,324.00","value":{"amount":192324,"currency":"USD"}},{"label":"MITWI04","value":"00530000001teY5AAI"},{"label":"William Mitts","value":"00530000001teY5AAI"},{"label":"Michael Molloy","value":"00530000000whJgAAI"},{"label":"100% - Contract Signed","value":"100% - Contract Signed"},{"label":"Services","value":"Services"},{"label":"Security","value":"Security"},{"label":"10/7/2016","value":"2016-10-07"}]},{"dataCells":[{"label":"899220","value":"899220"},{"label":"NA","value":"NA"},{"label":"Named/Growth","value":"Named/Growth"},{"label":"NG_SE","value":"NG_SE"},{"label":"NG_SE_NAMED","value":"NG_SE_NAMED"},{"label":"US - UNITED STATES","value":"US - UNITED STATES"},{"label":"LAKJA04","value":"00530000001qk6DAAQ"},{"label":"James Lake","value":"James Lake"},{"label":"Turner Capacity","value":"006a000001LLMniAAH"},{"label":"Turner Broadcasting","value":"0013000000HQYAqAAP"},{"label":"USD 164,400.00","value":{"amount":164400,"currency":"USD"}},{"label":"GILRO10","value":"005a000000BnAToAAN"},{"label":"Robert Gilliam","value":"005a000000BnAToAAN"},{"label":"Scott Westmoreland","value":"00530000004fOdhAAE"},{"label":"100% - Contract Signed","value":"100% - Contract Signed"},{"label":"PNCV","value":"PNCV"},{"label":"PPM","value":"PPM"},{"label":"10/12/2016","value":"2016-10-12"}]},{"dataCells":[{"label":"832357","value":"832357"},{"label":"NA","value":"NA"},{"label":"Named/Growth","value":"Named/Growth"},{"label":"NG_WEST","value":"NG_WEST"},{"label":"NG_WEST_NAMED","value":"NG_WEST_NAMED"},{"label":"US - UNITED STATES","value":"US - UNITED STATES"},{"label":"Gowner","value":"00530000006ca0qAAA"},{"label":"Generic Owner","value":"Generic Owner"},{"label":"Mercury - PAM","value":"006a000001FW3zQAAT"},{"label":"Mercury General Corporation","value":"00130000014MfPjAAK"},{"label":"USD 160,864.00","value":{"amount":160864,"currency":"USD"}},{"label":"DYNSE01","value":"0053000000466qvAAA"},{"label":"Serena Dynes","value":"0053000000466qvAAA"},{"label":"Connie Glaspie","value":"00530000000whBUAAY"},{"label":"100% - Contract Signed","value":"100% - Contract Signed"},{"label":"PNCV","value":"PNCV"},{"label":"Security","value":"Security"},{"label":"10/11/2016","value":"2016-10-11"}]},{"dataCells":[{"label":"844167","value":"844167"},{"label":"NA","value":"NA"},{"label":"Platinum","value":"Platinum"},{"label":"PLAT_SE","value":"PLAT_SE"},{"label":"PLAT_SE_GULF","value":"PLAT_SE_GULF"},{"label":"US - UNITED STATES","value":"US - UNITED STATES"},{"label":"GUTTH03","value":"00530000001byYyAAI"},{"label":"Theodore Guthrie","value":"Theodore Guthrie"},{"label":"Degussa OTP&PM","value":"006a000001GkovlAAB"},{"label":"Total System Services, Inc.","value":"0013000000HQYAwAAP"},{"label":"USD 159,502.08","value":{"amount":159502.0800261583411242899679443835547429,"currency":"USD"}},{"label":"KEUJE01","value":"005300000053SMzAAM"},{"label":"Dr. Jens Keuter","value":"005300000053SMzAAM"},{"label":"Edward Medcalf","value":"00530000004diKzAAI"},{"label":"100% - Contract Signed","value":"100% - Contract Signed"},{"label":"PNCV w/Services","value":"PNCV w/Services"},{"label":"Payment Security","value":"Payment Security"},{"label":"10/7/2016","value":"2016-10-07"}]},{"dataCells":[{"label":"824831","value":"824831"},{"label":"NA","value":"NA"},{"label":"Public Sector/Canada","value":"Public Sector/Canada"},{"label":"PS_SLED","value":"PS_SLED"},{"label":"PS_SL-WEST","value":"PS_SL-WEST"},{"label":"US - UNITED STATES","value":"US - UNITED STATES"},{"label":"HOFDA02","value":"005a000000Cjr5gAAB"},{"label":"David Hoffman","value":"David Hoffman"},{"label":"OREGON - STATE --- ASG MSRP","value":"006a000001FSTzDAAX"},{"label":"OREGON - STATE","value":"0013000000HQt5qAAD"},{"label":"USD 150,716.80","value":{"amount":150716.8,"currency":"USD"}},{"label":"HOFDA02","value":"005a000000Cjr5gAAB"},{"label":"David Hoffman","value":"005a000000Cjr5gAAB"},{"label":"Jack Alexander","value":"00530000000whLUAAY"},{"label":"100% - Contract Signed","value":"100% - Contract Signed"},{"label":"Services","value":"Services"},{"label":"Mainframe","value":"Mainframe"},{"label":"10/3/2016","value":"2016-10-03"}]},{"dataCells":[{"label":"895080","value":"895080"},{"label":"NA","value":"NA"},{"label":"Platinum","value":"Platinum"},{"label":"PLAT_WEST","value":"PLAT_WEST"},{"label":"PLAT_WEST_PLAINS","value":"PLAT_WEST_PLAINS"},{"label":"US - UNITED STATES","value":"US - UNITED STATES"},{"label":"JURRO01","value":"005300000018OhUAAU"},{"label":"Robert Jurek","value":"Robert Jurek"},{"label":"SAML Resource #2","value":"006a000000zOPhhAAG"},{"label":"Sprint Nextel Corporation","value":"0013000000HQY65AAH"},{"label":"USD 148,000.00","value":{"amount":148000,"currency":"USD"}},{"label":"FLEPA05","value":"005a000000AXNN5AAP"},{"label":"Pamela Fletcher","value":"005a000000AXNN5AAP"},{"label":"John Westrich","value":"00530000000whBYAAY"},{"label":"100% - Contract Signed","value":"100% - Contract Signed"},{"label":"Services","value":"Services"},{"label":"Security","value":"Security"},{"label":"10/10/2016","value":"2016-10-10"}]},{"dataCells":[{"label":"871592","value":"871592"},{"label":"EMEA","value":"EMEA"},{"label":"UKI","value":"UKI"},{"label":"UKI","value":"UKI"},{"label":"UK","value":"UK"},{"label":"GB - UNITED KINGDOM","value":"GB - UNITED KINGDOM"},{"label":"MORCA15","value":"005a000000COgIOAA1"},{"label":"Camille Morgan","value":"Camille Morgan"},{"label":"VODAFONE GROUP PLC MT 01 Oct 2016 (Indirect)","value":"006a000001JO3tKAAT"},{"label":"VODAFONE GROUP PLC","value":"0013000000HacAWAAZ"},{"label":"USD 142,070.99","value":{"amount":142070.9902970485188356458222602774986712,"currency":"USD"}},{"label":"NIJSA01","value":"00530000001b3gQAAQ"},{"label":"Satinder Nijjher","value":"00530000001b3gQAAQ"},{"label":"Kay Nevin","value":"00530000000wiKxAAI"},{"label":"100% - Contract Signed","value":"100% - Contract Signed"},{"label":"Renewal w/Products","value":"Renewal w/Products"},{"label":"Enterprise Management","value":"Enterprise Management"},{"label":"10/1/2016","value":"2016-10-01"}]},{"dataCells":[{"label":"885211","value":"885211"},{"label":"NA","value":"NA"},{"label":"Named/Growth","value":"Named/Growth"},{"label":"NG_WEST","value":"NG_WEST"},{"label":"NG_WEST_NAMED","value":"NG_WEST_NAMED"},{"label":"US - UNITED STATES","value":"US - UNITED STATES"},{"label":"CHAPE16","value":"005a000000B6AYBAA3"},{"label":"Peter Challender","value":"Peter Challender"},{"label":"Echostar - CDE for SCM Project","value":"006a000001KFv4VAAT"},{"label":"Echostar Corporation","value":"00130000014MfLoAAK"},{"label":"USD 139,296.00","value":{"amount":139296,"currency":"USD"}},{"label":"ENGJO02","value":"005300000022w3nAAA"},{"label":"John Engstrom","value":"005300000022w3nAAA"},{"label":"Peter Challender","value":"005a000000B6AYBAA3"},{"label":"100% - Contract Signed","value":"100% - Contract Signed"},{"label":"PNCV w/Services","value":"PNCV w/Services"},{"label":"Continuous Delivery","value":"Continuous Delivery"},{"label":"10/10/2016","value":"2016-10-10"}]},{"dataCells":[{"label":"891887","value":"891887"},{"label":"APJ","value":"APJ"},{"label":"GREATER CHINA","value":"GREATER CHINA"},{"label":"HONG KONG","value":"HONG KONG"},{"label":"HONG KONG","value":"HONG KONG"},{"label":"HK - HONG KONG","value":"HK - HONG KONG"},{"label":"STEMI23","value":"00530000001tAVHAA2"},{"label":"Stephen Miles","value":"Stephen Miles"},{"label":"HA (LIS Division)-APM Phase 1-ASL","value":"006a000000zRdscAAC"},{"label":"Hospital Authority","value":"0013000000olLBGAA2"},{"label":"USD 139,012.42","value":{"amount":139012.4188837547254340502151339736963108,"currency":"USD"}},{"label":"MABWA01","value":"005a000000Cnzu1AAB"},{"label":"Wai Kwong Lance Ma","value":"005a000000Cnzu1AAB"},{"label":"SK Cheung","value":"005a000000BES43AAH"},{"label":"100% - Contract Signed","value":"100% - Contract Signed"},{"label":"PNCV","value":"PNCV"},{"label":"Enterprise Management","value":"Enterprise Management"},{"label":"10/13/2016","value":"2016-10-13"}]},{"dataCells":[{"label":"862606","value":"862606"},{"label":"LA","value":"LA"},{"label":"ANDEAN","value":"ANDEAN"},{"label":"ANDEAN - NORTH","value":"ANDEAN - NORTH"},{"label":"COLOMBIA","value":"COLOMBIA"},{"label":"CO - COLOMBIA","value":"CO - COLOMBIA"},{"label":"BARRO31","value":"00530000005nfk5AAA"},{"label":"Rolando Barajas","value":"Rolando Barajas"},{"label":"Hitss for Claro - PPM Services for IT","value":"006a000001IuVczAAF"},{"label":"CLARO - Colombia","value":"0013000000HQXYEAA5"},{"label":"USD 134,930.00","value":{"amount":134930,"currency":"USD"}},{"label":"BARRO31","value":"00530000005nfk5AAA"},{"label":"Rolando Barajas","value":"00530000005nfk5AAA"},{"label":"Fernando Ramirez","value":"00530000000wiAoAAI"},{"label":"100% - Contract Signed","value":"100% - Contract Signed"},{"label":"Services","value":"Services"},{"label":"PPM","value":"PPM"},{"label":"10/10/2016","value":"2016-10-10"}]},{"dataCells":[{"label":"896533","value":"896533"},{"label":"APJ","value":"APJ"},{"label":"ASIA SOUTH","value":"ASIA SOUTH"},{"label":"SINGAPORE","value":"SINGAPORE"},{"label":"SINGAPORE","value":"SINGAPORE"},{"label":"SG - SINGAPORE","value":"SG - SINGAPORE"},{"label":"LIMPA04","value":"00530000000wl0xAAA"},{"label":"Patricia Kar Ling Lim","value":"Patricia Kar Ling Lim"},{"label":"PNCV-SG-OCBC CN-EM Appliances","value":"006a000000zOWCsAAO"},{"label":"OVERSEA-CHINESE BANKING CORPORATION LIMITED","value":"0013000000qY3gnAAC"},{"label":"USD 131,996.81","value":{"amount":131996.8097688896584978423162982754572119,"currency":"USD"}},{"label":"LIMPA04","value":"00530000000wl0xAAA"},{"label":"Patricia Kar Ling Lim","value":"00530000000wl0xAAA"},{"label":"Nick Lim","value":"005a000000C0FvhAAF"},{"label":"100% - Contract Signed","value":"100% - Contract Signed"},{"label":"PNCV","value":"PNCV"},{"label":"Enterprise Management","value":"Enterprise Management"},{"label":"10/11/2016","value":"2016-10-11"}]},{"dataCells":[{"label":"886150","value":"886150"},{"label":"NA","value":"NA"},{"label":"Named/Growth","value":"Named/Growth"},{"label":"NG_WEST","value":"NG_WEST"},{"label":"NG_WEST_NAMED","value":"NG_WEST_NAMED"},{"label":"US - UNITED STATES","value":"US - UNITED STATES"},{"label":"Gowner","value":"00530000006ca0qAAA"},{"label":"Generic Owner","value":"Generic Owner"},{"label":"BCBS - IAM Services","value":"006a000001KG6i7AAD"},{"label":"Blue Cross and Blue Shield of Arizona, Inc.","value":"0013000000MyQJWAA3"},{"label":"USD 125,040.00","value":{"amount":125040,"currency":"USD"}},{"label":"DYNSE01","value":"0053000000466qvAAA"},{"label":"Serena Dynes","value":"0053000000466qvAAA"},{"label":"Connie Glaspie","value":"00530000000whBUAAY"},{"label":"100% - Contract Signed","value":"100% - Contract Signed"},{"label":"Services","value":"Services"},{"label":"Security","value":"Security"},{"label":"10/5/2016","value":"2016-10-05"}]},{"dataCells":[{"label":"870349","value":"870349"},{"label":"EMEA","value":"EMEA"},{"label":"STH","value":"STH"},{"label":"MIDIS","value":"MIDIS"},{"label":"TURKEY","value":"TURKEY"},{"label":"TR - TURKEY","value":"TR - TURKEY"},{"label":"Gowner","value":"00530000006ca0qAAA"},{"label":"Generic Owner","value":"Generic Owner"},{"label":"ARCELIK A S MT 30 Sep 2016 (Indirect)","value":"006a000001JO3DBAA1"},{"label":"ARCELIK A S","value":"00130000014MYo0AAG"},{"label":"USD 119,438.10","value":{"amount":119438.1,"currency":"USD"}},{"label":"ONCBE02","value":"005a000000BEXNbAAP"},{"label":"Berke Oncul","value":"005a000000BEXNbAAP"},{"label":"Levent Sensezgin","value":"005a0000007rJJHAA2"},{"label":"100% - Contract Signed","value":"100% - Contract Signed"},{"label":"Renewal w/Products","value":"Renewal w/Products"},{"label":"Service Management","value":"Service Management"},{"label":"10/3/2016","value":"2016-10-03"}]},{"dataCells":[{"label":"881836","value":"881836"},{"label":"APJ","value":"APJ"},{"label":"ANZ","value":"ANZ"},{"label":"AUSTRALIA","value":"AUSTRALIA"},{"label":"AUSTRALIA","value":"AUSTRALIA"},{"label":"AU - AUSTRALIA","value":"AU - AUSTRALIA"},{"label":"LOMBR01","value":"005a000000CnylmAAB"},{"label":"Brian Lombardi","value":"Brian Lombardi"},{"label":"Transurban - dSeries Test Server and Agents","value":"006a000001JR4SmAAL"},{"label":"TRANSURBAN LIMITED","value":"0013000000iuwn8AAA"},{"label":"USD 119,395.60","value":{"amount":119395.6009838218960666921330829632159673,"currency":"USD"}},{"label":"LOMBR01","value":"005a000000CnylmAAB"},{"label":"Brian Lombardi","value":"005a000000CnylmAAB"},{"label":"Ivan Lobo","value":"0053000000533lAAAQ"},{"label":"100% - Contract Signed","value":"100% - Contract Signed"},{"label":"PNCV","value":"PNCV"},{"label":"Workload Automation","value":"Workload Automation"},{"label":"10/4/2016","value":"2016-10-04"}]},{"dataCells":[{"label":"910748","value":"910748"},{"label":"NA","value":"NA"},{"label":"Named/Growth","value":"Named/Growth"},{"label":"NG_SW","value":"NG_SW"},{"label":"NG_SW_NAMED","value":"NG_SW_NAMED"},{"label":"US - UNITED STATES","value":"US - UNITED STATES"},{"label":"Gowner","value":"00530000006ca0qAAA"},{"label":"Generic Owner","value":"Generic Owner"},{"label":"Pizza Hut MT 01 Nov 2016 46252","value":"0061b000002YwjDAAS"},{"label":"Pizza Hut","value":"001a000001kbSBQAA2"},{"label":"USD 117,619.99","value":{"amount":117619.99,"currency":"USD"}},{"label":"PATSA26","value":"005a000000CQtDZAA1"},{"label":"Samuel Patton","value":"005a000000CQtDZAA1"},{"label":"Daniel Cooper","value":"005a000000COjMEAA1"},{"label":"100% - Contract Signed","value":"100% - Contract Signed"},{"label":"Renewal w/Products","value":"Renewal w/Products"},{"label":"Agile Central","value":"Agile Central"},{"label":"11/29/2016","value":"2016-11-29"}]},{"dataCells":[{"label":"900160","value":"900160"},{"label":"NA","value":"NA"},{"label":"Named/Growth","value":"Named/Growth"},{"label":"NG_SW","value":"NG_SW"},{"label":"NG_SW_NAMED","value":"NG_SW_NAMED"},{"label":"US - UNITED STATES","value":"US - UNITED STATES"},{"label":"Gowner","value":"00530000006ca0qAAA"},{"label":"Generic Owner","value":"Generic Owner"},{"label":"AAG - WebServices (direct MSA)","value":"006a000001LLVv9AAH"},{"label":"AMR Corporation","value":"0013000000HQXarAAH"},{"label":"USD 117,075.00","value":{"amount":117075,"currency":"USD"}},{"label":"LAGMA04","value":"005a0000009dBUJAA2"},{"label":"Mark LaGrone","value":"005a0000009dBUJAA2"},{"label":"Jay Maples","value":"0053000000230WxAAI"},{"label":"100% - Contract Signed","value":"100% - Contract Signed"},{"label":"Services w/Education","value":"Services w/Education"},{"label":"API Management","value":"API Management"},{"label":"10/3/2016","value":"2016-10-03"}]},{"dataCells":[{"label":"901611","value":"901611"},{"label":"LA","value":"LA"},{"label":"ANDEAN","value":"ANDEAN"},{"label":"ANDEAN - NORTH","value":"ANDEAN - NORTH"},{"label":"COLOMBIA","value":"COLOMBIA"},{"label":"CO - COLOMBIA","value":"CO - COLOMBIA"},{"label":"Gowner","value":"00530000006ca0qAAA"},{"label":"Generic Owner","value":"Generic Owner"},{"label":"IT Solutions-CREDIBANCO-PPM","value":"006a000001LLq1BAAT"},{"label":"Asociacion de Bancos que prestan servicios de Credibanco Credibanco","value":"0013000000v86cgAAA"},{"label":"USD 110,708.00","value":{"amount":110708,"currency":"USD"}},{"label":"AMARU02","value":"005a000000B6cTTAAZ"},{"label":"Ruth Amaya Cortes","value":"005a000000B6cTTAAZ"},{"label":"Rene Osorio","value":"005a000000B5tdrAAB"},{"label":"100% - Contract Signed","value":"100% - Contract Signed"},{"label":"PNCV","value":"PNCV"},{"label":"PPM","value":"PPM"},{"label":"10/1/2016","value":"2016-10-01"}]},{"dataCells":[{"label":"895834","value":"895834"},{"label":"APJ","value":"APJ"},{"label":"ASIA SOUTH","value":"ASIA SOUTH"},{"label":"SINGAPORE","value":"SINGAPORE"},{"label":"SINGAPORE","value":"SINGAPORE"},{"label":"SG - SINGAPORE","value":"SG - SINGAPORE"},{"label":"LIMPA04","value":"00530000000wl0xAAA"},{"label":"Patricia Kar Ling Lim","value":"Patricia Kar Ling Lim"},{"label":"PNCV-SG-DBS-APM iServ","value":"006a000000zORgYAAW"},{"label":"DBS GROUP HOLDINGS LTD","value":"0013000000iuwt1AAA"},{"label":"USD 101,682.26","value":{"amount":101682.2592343279307175091094102310753369,"currency":"USD"}},{"label":"LIMPA04","value":"00530000000wl0xAAA"},{"label":"Patricia Kar Ling Lim","value":"00530000000wl0xAAA"},{"label":"Nick Lim","value":"005a000000C0FvhAAF"},{"label":"100% - Contract Signed","value":"100% - Contract Signed"},{"label":"PNCV","value":"PNCV"},{"label":"Enterprise Management","value":"Enterprise Management"},{"label":"10/3/2016","value":"2016-10-03"}]},{"dataCells":[{"label":"842983","value":"842983"},{"label":"EMEA","value":"EMEA"},{"label":"CEN","value":"CEN"},{"label":"GERMANY","value":"GERMANY"},{"label":"GERMANY","value":"GERMANY"},{"label":"DE - GERMANY","value":"DE - GERMANY"},{"label":"LUDDA01","value":"005300000017Y0wAAE"},{"label":"Daniel Ludwig","value":"Daniel Ludwig"},{"label":"VW-Education-Onsite-SMILE-Nutzfahrzeuge","value":"006a000001GkJouAAF"},{"label":"VOLKSWAGEN AG","value":"0013000000Hac00AAB"},{"label":"USD 100,832.49","value":{"amount":100832.4900165365283627119906514847664668,"currency":"USD"}},{"label":"DERTA01","value":"005a000000BneY8AAJ"},{"label":"Taimaz Derakhshan","value":"005a000000BneY8AAJ"},{"label":"Steve Macfarlane","value":"005300000015fKLAAY"},{"label":"100% - Contract Signed","value":"100% - Contract Signed"},{"label":"Standalone Education","value":"Standalone Education"},{"label":"Enterprise Management","value":"Enterprise Management"},{"label":"10/17/2016","value":"2016-10-17"}]},{"dataCells":[{"label":"878100","value":"878100"},{"label":"NA","value":"NA"},{"label":"Named/Growth","value":"Named/Growth"},{"label":"NG_WEST","value":"NG_WEST"},{"label":"NG_WEST_NAMED","value":"NG_WEST_NAMED"},{"label":"US - UNITED STATES","value":"US - UNITED STATES"},{"label":"LEMDA04","value":"00530000003JBK4AAO"},{"label":"David Lemieux","value":"David Lemieux"},{"label":"SNEI - APM Summary MOM PWP and Svcs","value":"006a000001JPu2PAAT"},{"label":"Sony Corp (West Coast)","value":"0013000000HQY5lAAH"},{"label":"USD 100,320.00","value":{"amount":100320,"currency":"USD"}},{"label":"PINJA08","value":"00530000003rrCcAAI"},{"label":"Jason Ping","value":"00530000003rrCcAAI"},{"label":"David Lemieux","value":"00530000003JBK4AAO"},{"label":"100% - Contract Signed","value":"100% - Contract Signed"},{"label":"Services","value":"Services"},{"label":"Enterprise Management","value":"Enterprise Management"},{"label":"10/6/2016","value":"2016-10-06"}]},{"dataCells":[{"label":"896844","value":"896844"},{"label":"EMEA","value":"EMEA"},{"label":"CEN","value":"CEN"},{"label":"GERMANY","value":"GERMANY"},{"label":"GERMANY","value":"GERMANY"},{"label":"DE - GERMANY","value":"DE - GERMANY"},{"label":"Gowner","value":"00530000006ca0qAAA"},{"label":"Generic Owner","value":"Generic Owner"},{"label":"Bayernwerk - EniM WAN Concept","value":"006a000000zOYjfAAG"},{"label":"E.ON AG","value":"0013000000HabznAAB"},{"label":"USD 96,957.60","value":{"amount":96957.600015901046402607771610027674544,"currency":"USD"}},{"label":"SAFAN01","value":"00530000002FrxsAAC"},{"label":"Andre Safavi","value":"00530000002FrxsAAC"},{"label":"Sefa Oezsoy","value":"005300000017lL7AAI"},{"label":"100% - Contract Signed","value":"100% - Contract Signed"},{"label":"Services","value":"Services"},{"label":"Enterprise Management","value":"Enterprise Management"},{"label":"10/6/2016","value":"2016-10-06"}]},{"dataCells":[{"label":"903169","value":"903169"},{"label":"NA","value":"NA"},{"label":"Public Sector/Canada","value":"Public Sector/Canada"},{"label":"PS_FED/FSI","value":"PS_FED/FSI"},{"label":"PS_HEALTH","value":"PS_HEALTH"},{"label":"US - UNITED STATES","value":"US - UNITED STATES"},{"label":"TOMNA01","value":"00530000000whCmAAI"},{"label":"Nancy Tome","value":"Nancy Tome"},{"label":"SSA ELA - Option Year 4 (Mod 18) - Services","value":"006a000001LM1XZAA1"},{"label":"SOCIAL SECURITY ADMINISTRATION","value":"0013000000HQYFPAA5"},{"label":"USD 92,976.00","value":{"amount":92976,"currency":"USD"}},{"label":"GORTI01","value":"0053000000489waAAA"},{"label":"Timothy Gorgos","value":"0053000000489waAAA"},{"label":"Cameron Sedgwick","value":"0053000000172I6AAI"},{"label":"100% - Contract Signed","value":"100% - Contract Signed"},{"label":"Services","value":"Services"},{"label":"N/A","value":"N/A"},{"label":"10/7/2016","value":"2016-10-07"}]},{"dataCells":[{"label":"894440","value":"894440"},{"label":"EMEA","value":"EMEA"},{"label":"NTH","value":"NTH"},{"label":"SWEDEN","value":"SWEDEN"},{"label":"SWEDEN","value":"SWEDEN"},{"label":"CH - SWITZERLAND","value":"CH - SWITZERLAND"},{"label":"EM_PARTN","value":"00530000006cIJ0AAM"},{"label":"EMEA PARTNER","value":"EMEA PARTNER"},{"label":"Ericsson additional resources Q3","value":"006a000000zRuulAAC"},{"label":"Tata Consultancy Services (EMEA)","value":"001a000001J6ffxAAB"},{"label":"USD 91,032.00","value":{"amount":91032,"currency":"USD"}},{"label":"VILPA05","value":"00530000005U8KrAAK"},{"label":"Pasi Vilen","value":"00530000005U8KrAAK"},{"label":"Odd Heimstad","value":"0053000000160XMAAY"},{"label":"100% - Contract Signed","value":"100% - Contract Signed"},{"label":"Services","value":"Services"},{"label":"PPM","value":"PPM"},{"label":"10/10/2016","value":"2016-10-10"}]},{"dataCells":[{"label":"910772","value":"910772"},{"label":"NA","value":"NA"},{"label":"Named/Growth","value":"Named/Growth"},{"label":"NG_WEST","value":"NG_WEST"},{"label":"NG_WEST_GROWTH","value":"NG_WEST_GROWTH"},{"label":"US - UNITED STATES","value":"US - UNITED STATES"},{"label":"Gowner","value":"00530000006ca0qAAA"},{"label":"Generic Owner","value":"Generic Owner"},{"label":"Xirrus, Inc. MT 01 Nov 2016 13623","value":"0061b000002YwjbAAC"},{"label":"Xirrus, Inc.","value":"001a000001ka8uFAAQ"},{"label":"USD 83,942.44","value":{"amount":83942.44,"currency":"USD"}},{"label":"PARRE02","value":"005a000000BEFRXAA5"},{"label":"Reshma Parikh","value":"005a000000BEFRXAA5"},{"label":"Daniel Cooper","value":"005a000000COjMEAA1"},{"label":"100% - Contract Signed","value":"100% - Contract Signed"},{"label":"Renewal w/Products","value":"Renewal w/Products"},{"label":"Agile Central","value":"Agile Central"},{"label":"11/21/2016","value":"2016-11-21"}]},{"dataCells":[{"label":"901870","value":"901870"},{"label":"EMEA","value":"EMEA"},{"label":"UKI","value":"UKI"},{"label":"UKI","value":"UKI"},{"label":"UK","value":"UK"},{"label":"GB - UNITED KINGDOM","value":"GB - UNITED KINGDOM"},{"label":"EM_PARTN","value":"00530000006cIJ0AAM"},{"label":"EMEA PARTNER","value":"EMEA PARTNER"},{"label":"Fujitsu - CSDP Southern Water","value":"006a000001LLu5yAAD"},{"label":"Fujitsu Technology Services (EMEA)","value":"001a000001J6fgGAAR"},{"label":"USD 83,374.16","value":{"amount":83374.1600100048992012005879041440705485,"currency":"USD"}},{"label":"PATSM01","value":"00530000000wiL4AAI"},{"label":"Smita Patel","value":"00530000000wiL4AAI"},{"label":"Louise Ashbrook","value":"005a000000CQdHhAAL"},{"label":"100% - Contract Signed","value":"100% - Contract Signed"},{"label":"PNCV","value":"PNCV"},{"label":"Enterprise Management","value":"Enterprise Management"},{"label":"10/17/2016","value":"2016-10-17"}]},{"dataCells":[{"label":"897801","value":"897801"},{"label":"EMEA","value":"EMEA"},{"label":"NTH","value":"NTH"},{"label":"BELUX","value":"BELUX"},{"label":"BELGIUM","value":"BELGIUM"},{"label":"BE - BELGIUM","value":"BE - BELGIUM"},{"label":"JANLE01","value":"00530000000wnViAAI"},{"label":"Dirk Janssen","value":"Dirk Janssen"},{"label":"B_BNPPF_RA_Se_DJ","value":"006a000000zOnUlAAK"},{"label":"BNP PARIBAS","value":"0013000000HabwRAAR"},{"label":"USD 81,936.00","value":{"amount":81936.0000134375040022037506563614151076,"currency":"USD"}},{"label":"JANLE01","value":"00530000000wnViAAI"},{"label":"Dirk Janssen","value":"00530000000wnViAAI"},{"label":"Steven Moerman","value":"005a000000AKVz0AAH"},{"label":"100% - Contract Signed","value":"100% - Contract Signed"},{"label":"Services","value":"Services"},{"label":"Continuous Delivery","value":"Continuous Delivery"},{"label":"10/4/2016","value":"2016-10-04"}]},{"dataCells":[{"label":"821601","value":"821601"},{"label":"APJ","value":"APJ"},{"label":"ASIA SOUTH","value":"ASIA SOUTH"},{"label":"SINGAPORE","value":"SINGAPORE"},{"label":"SINGAPORE","value":"SINGAPORE"},{"label":"SG - SINGAPORE","value":"SG - SINGAPORE"},{"label":"YANCH06","value":"005a000000C0taHAAR"},{"label":"Chin Hwang Yan","value":"Chin Hwang Yan"},{"label":"PNCV-SG-Singtel-SEC_DIR","value":"006a000001EgyCUAAZ"},{"label":"SINGAPORE TELECOMMUNICATIONS","value":"00130000014Mf8RAAS"},{"label":"USD 79,892.57","value":{"amount":79892.5680269717309659056563740897495919,"currency":"USD"}},{"label":"YANCH06","value":"005a000000C0taHAAR"},{"label":"Chin Hwang Yan","value":"005a000000C0taHAAR"},{"label":"Nick Lim","value":"005a000000C0FvhAAF"},{"label":"100% - Contract Signed","value":"100% - Contract Signed"},{"label":"PNCV","value":"PNCV"},{"label":"Security","value":"Security"},{"label":"10/17/2016","value":"2016-10-17"}]},{"dataCells":[{"label":"880877","value":"880877"},{"label":"NA","value":"NA"},{"label":"Named/Growth","value":"Named/Growth"},{"label":"NG_WEST","value":"NG_WEST"},{"label":"NG_WEST_NAMED","value":"NG_WEST_NAMED"},{"label":"US - UNITED STATES","value":"US - UNITED STATES"},{"label":"Gowner","value":"00530000006ca0qAAA"},{"label":"Generic Owner","value":"Generic Owner"},{"label":"Ball - IdM Capacity","value":"006a000001JQncWAAT"},{"label":"Ball Corporation","value":"0013000000HQXcgAAH"},{"label":"USD 79,844.93","value":{"amount":79844.93,"currency":"USD"}},{"label":"GREJE16","value":"005a000000BEA55AAH"},{"label":"Jeremy Greene Taub","value":"005a000000BEA55AAH"},{"label":"Connie Glaspie","value":"00530000000whBUAAY"},{"label":"100% - Contract Signed","value":"100% - Contract Signed"},{"label":"PNCV","value":"PNCV"},{"label":"Security","value":"Security"},{"label":"10/14/2016","value":"2016-10-14"}]},{"dataCells":[{"label":"885825","value":"885825"},{"label":"NA","value":"NA"},{"label":"Public Sector/Canada","value":"Public Sector/Canada"},{"label":"PS_CANADA","value":"PS_CANADA"},{"label":"PS_CAN_WEST-CTL","value":"PS_CAN_WEST-CTL"},{"label":"CA - CANADA","value":"CA - CANADA"},{"label":"DESSA08","value":"005a000000AXB2xAAH"},{"label":"Saurin Desai","value":"Saurin Desai"},{"label":"Rogers SV Adoption","value":"006a000001KG13ZAAT"},{"label":"Rogers Communications Canada Inc","value":"0013000000HQY3iAAH"},{"label":"USD 76,900.00","value":{"amount":76900.0000020763000000560601000015136227,"currency":"USD"}},{"label":"DESSA08","value":"005a000000AXB2xAAH"},{"label":"Saurin Desai","value":"005a000000AXB2xAAH"},{"label":"Raj Juneja","value":"00530000000whNYAAY"},{"label":"100% - Contract Signed","value":"100% - Contract Signed"},{"label":"Services","value":"Services"},{"label":"Continuous Delivery","value":"Continuous Delivery"},{"label":"10/17/2016","value":"2016-10-17"}]},{"dataCells":[{"label":"865503","value":"865503"},{"label":"NA","value":"NA"},{"label":"Platinum","value":"Platinum"},{"label":"PLAT_NE","value":"PLAT_NE"},{"label":"PLAT_NE_NEWENG","value":"PLAT_NE_NEWENG"},{"label":"US - UNITED STATES","value":"US - UNITED STATES"},{"label":"TAMJA01","value":"00530000000wh9aAAA"},{"label":"James Tammen","value":"James Tammen"},{"label":"APM 10 Upgrade ProSvs","value":"006a000001IwMmjAAF"},{"label":"Liberty Mutual Holding Company Inc","value":"0013000000HQXuPAAX"},{"label":"USD 76,600.00","value":{"amount":76600,"currency":"USD"}},{"label":"TAMJA01","value":"00530000000wh9aAAA"},{"label":"James Tammen","value":"00530000000wh9aAAA"},{"label":"Brian Pallotta","value":"00530000000whGuAAI"},{"label":"100% - Contract Signed","value":"100% - Contract Signed"},{"label":"Services","value":"Services"},{"label":"Enterprise Management","value":"Enterprise Management"},{"label":"10/7/2016","value":"2016-10-07"}]},{"dataCells":[{"label":"894438","value":"894438"},{"label":"EMEA","value":"EMEA"},{"label":"NTH","value":"NTH"},{"label":"SWEDEN","value":"SWEDEN"},{"label":"SWEDEN","value":"SWEDEN"},{"label":"SE - SWEDEN","value":"SE - SWEDEN"},{"label":"ANDNI05","value":"005a000000B73fHAAR"},{"label":"Niklas Andrae","value":"Niklas Andrae"},{"label":"Ericsson SAP Integration","value":"006a000000zRuuWAAS"},{"label":"Ericsson AB","value":"0013000000HabydAAB"},{"label":"USD 76,000.00","value":{"amount":76000,"currency":"USD"}},{"label":"VILPA05","value":"00530000005U8KrAAK"},{"label":"Pasi Vilen","value":"00530000005U8KrAAK"},{"label":"Odd Heimstad","value":"0053000000160XMAAY"},{"label":"100% - Contract Signed","value":"100% - Contract Signed"},{"label":"Services","value":"Services"},{"label":"PPM","value":"PPM"},{"label":"10/5/2016","value":"2016-10-05"}]},{"dataCells":[{"label":"886826","value":"886826"},{"label":"EMEA","value":"EMEA"},{"label":"STH","value":"STH"},{"label":"ITALY","value":"ITALY"},{"label":"ITALY","value":"ITALY"},{"label":"IT - ITALY","value":"IT - ITALY"},{"label":"GIUST01","value":"00530000000wiHkAAI"},{"label":"Stefano Giuliani","value":"Stefano Giuliani"},{"label":"ICCREA SRV MF","value":"006a000001KGGl7AAH"},{"label":"ICCREA HOLDING SPA","value":"0013000000HabukAAB"},{"label":"USD 68,280.00","value":{"amount":68280.0000111979200018364588803011792564,"currency":"USD"}},{"label":"GIUST01","value":"00530000000wiHkAAI"},{"label":"Stefano Giuliani","value":"00530000000wiHkAAI"},{"label":"Michele Lamartina","value":"005a000000BESUJAA5"},{"label":"100% - Contract Signed","value":"100% - Contract Signed"},{"label":"Services","value":"Services"},{"label":"Mainframe","value":"Mainframe"},{"label":"10/10/2016","value":"2016-10-10"}]},{"dataCells":[{"label":"904280","value":"904280"},{"label":"NA","value":"NA"},{"label":"Public Sector/Canada","value":"Public Sector/Canada"},{"label":"PS_CANADA","value":"PS_CANADA"},{"label":"PS_CAN_WEST-CTL","value":"PS_CAN_WEST-CTL"},{"label":"CA - CANADA","value":"CA - CANADA"},{"label":"GOUJA02","value":"005a000000B6O4tAAF"},{"label":"Jason Gough","value":"Jason Gough"},{"label":"v3 TD - SDM 12.6 - Extended Support","value":"006a000001LMAOUAA5"},{"label":"Toronto-Dominion Bank","value":"0013000000HQY9hAAH"},{"label":"USD 66,845.90","value":{"amount":66845.9017518048393472987306623770657279,"currency":"USD"}},{"label":"GOUJA02","value":"005a000000B6O4tAAF"},{"label":"Jason Gough","value":"005a000000B6O4tAAF"},{"label":"Raj Juneja","value":"00530000000whNYAAY"},{"label":"100% - Contract Signed","value":"100% - Contract Signed"},{"label":"Support","value":"Support"},{"label":"Service Management","value":"Service Management"},{"label":"10/17/2016","value":"2016-10-17"}]},{"dataCells":[{"label":"897512","value":"897512"},{"label":"EMEA","value":"EMEA"},{"label":"CEN","value":"CEN"},{"label":"GERMANY","value":"GERMANY"},{"label":"GERMANY","value":"GERMANY"},{"label":"DE - GERMANY","value":"DE - GERMANY"},{"label":"EM_PARTN","value":"00530000006cIJ0AAM"},{"label":"EMEA PARTNER","value":"EMEA PARTNER"},{"label":"T-Systems MMS: PPM: Capacity 2016_1","value":"006a000000zOiCIAA0"},{"label":"T-Systems International GmbH","value":"0013000000TDfAmAAL"},{"label":"USD 66,210.76","value":{"amount":66210.7632308585651698608046878571719688,"currency":"USD"}},{"label":"SCHST25","value":"005300000019EP0AAM"},{"label":"Steffen Schostok","value":"005300000019EP0AAM"},{"label":"Timothy Smithson","value":"005a000000BDpztAAD"},{"label":"100% - Contract Signed","value":"100% - Contract Signed"},{"label":"PNCV","value":"PNCV"},{"label":"PPM","value":"PPM"},{"label":"10/10/2016","value":"2016-10-10"}]},{"dataCells":[{"label":"894402","value":"894402"},{"label":"NA","value":"NA"},{"label":"Named/Growth","value":"Named/Growth"},{"label":"NG_NE","value":"NG_NE"},{"label":"NG_NE_NAMED","value":"NG_NE_NAMED"},{"label":"US - UNITED STATES","value":"US - UNITED STATES"},{"label":"Gowner","value":"00530000006ca0qAAA"},{"label":"Generic Owner","value":"Generic Owner"},{"label":"Xerox - APM Services","value":"006a000000zRuKiAAK"},{"label":"Xerox Corporation","value":"0013000000HQXnuAAH"},{"label":"USD 66,096.00","value":{"amount":66096,"currency":"USD"}},{"label":"MOHVI02","value":"00530000004OSQhAAO"},{"label":"Vineet Joseph","value":"00530000004OSQhAAO"},{"label":"Scott Westmoreland","value":"00530000004fOdhAAE"},{"label":"100% - Contract Signed","value":"100% - Contract Signed"},{"label":"Services","value":"Services"},{"label":"PPM","value":"PPM"},{"label":"10/12/2016","value":"2016-10-12"}]},{"dataCells":[{"label":"894279","value":"894279"},{"label":"EMEA","value":"EMEA"},{"label":"NTH","value":"NTH"},{"label":"NORWAY","value":"NORWAY"},{"label":"NORWAY","value":"NORWAY"},{"label":"NO - NORWAY","value":"NO - NORWAY"},{"label":"Gowner","value":"00530000006ca0qAAA"},{"label":"Generic Owner","value":"Generic Owner"},{"label":"TV2-UIM-Services","value":"006a000000zRsrQAAS"},{"label":"Egmont Fonden","value":"001a000001J6UxTAAV"},{"label":"USD 56,617.47","value":{"amount":56617.4699991733849380120685799050237987,"currency":"USD"}},{"label":"STEJO31","value":"005a000000AKW03AAH"},{"label":"John Steinvik","value":"005a000000AKW03AAH"},{"label":"Tore Nilsen","value":"00530000001b4qUAAQ"},{"label":"100% - Contract Signed","value":"100% - Contract Signed"},{"label":"Services","value":"Services"},{"label":"Enterprise Management","value":"Enterprise Management"},{"label":"10/17/2016","value":"2016-10-17"}]},{"dataCells":[{"label":"866049","value":"866049"},{"label":"NA","value":"NA"},{"label":"Public Sector/Canada","value":"Public Sector/Canada"},{"label":"PS_FED/FSI","value":"PS_FED/FSI"},{"label":"PS_DOD/INTEL","value":"PS_DOD/INTEL"},{"label":"US - UNITED STATES","value":"US - UNITED STATES"},{"label":"FRYEL01","value":"005a000000AvGXQAA3"},{"label":"Elizabeth Bodell","value":"Elizabeth Bodell"},{"label":"DOJ -NCV WP DGE and (5) WE renewal","value":"006a000001IwfzhAAB"},{"label":"DEPARTMENT OF JUSTICE","value":"0013000000HQYGNAA5"},{"label":"USD 52,104.70","value":{"amount":52104.7,"currency":"USD"}},{"label":"LIVST03","value":"005a000000Ck8FTAAZ"},{"label":"Stephen Lively","value":"005a000000Ck8FTAAZ"},{"label":"Thomas Knowland","value":"005a000000CQqH2AAL"},{"label":"100% - Contract Signed","value":"100% - Contract Signed"},{"label":"PNCV","value":"PNCV"},{"label":"Erwin","value":"Erwin"},{"label":"10/2/2016","value":"2016-10-02"}]},{"dataCells":[{"label":"901375","value":"901375"},{"label":"EMEA","value":"EMEA"},{"label":"UKI","value":"UKI"},{"label":"SA","value":"SA"},{"label":"SOUTH AFRICA","value":"SOUTH AFRICA"},{"label":"ZA - SOUTH AFRICA","value":"ZA - SOUTH AFRICA"},{"label":"Gowner","value":"00530000006ca0qAAA"},{"label":"Generic Owner","value":"Generic Owner"},{"label":"ABSA - UIM (No Windows)CASA1384","value":"006a000001LLkPnAAL"},{"label":"ABSA BANK LIMITED","value":"001a000001J6TcgAAF"},{"label":"USD 50,006.25","value":{"amount":50006.25,"currency":"USD"}},{"label":"SNYDO02","value":"00530000006bQqeAAE"},{"label":"Dolf Snyman","value":"00530000006bQqeAAE"},{"label":"Gordon Hayden","value":"00530000006bQqsAAE"},{"label":"100% - Contract Signed","value":"100% - Contract Signed"},{"label":"PNCV","value":"PNCV"},{"label":"Enterprise Management","value":"Enterprise Management"},{"label":"10/13/2016","value":"2016-10-13"}]},{"dataCells":[{"label":"894865","value":"894865"},{"label":"NA","value":"NA"},{"label":"Platinum","value":"Platinum"},{"label":"PLAT_NE","value":"PLAT_NE"},{"label":"PLAT_NE_GRNY","value":"PLAT_NE_GRNY"},{"label":"US - UNITED STATES","value":"US - UNITED STATES"},{"label":"CIVCH02","value":"00530000007o2XHAAY"},{"label":"Christi Civalier","value":"Christi Civalier"},{"label":"M&T 3D-Secure Services","value":"006a000000zOOxWAAW"},{"label":"M&T Bank Corporation","value":"0013000000HQXusAAH"},{"label":"USD 50,000.00","value":{"amount":50000,"currency":"USD"}},{"label":"MOOWI06","value":"00530000004LnstAAC"},{"label":"William Moore","value":"00530000004LnstAAC"},{"label":"James Jenkins","value":"005300000068s42AAA"},{"label":"100% - Contract Signed","value":"100% - Contract Signed"},{"label":"Services","value":"Services"},{"label":"Payment Security","value":"Payment Security"},{"label":"10/17/2016","value":"2016-10-17"}]},{"dataCells":[{"label":"908253","value":"908253"},{"label":"NA","value":"NA"},{"label":"Named/Growth","value":"Named/Growth"},{"label":"NG_WEST","value":"NG_WEST"},{"label":"NG_WEST_GROWTH","value":"NG_WEST_GROWTH"},{"label":"US - UNITED STATES","value":"US - UNITED STATES"},{"label":"Gowner","value":"00530000006ca0qAAA"},{"label":"Generic Owner","value":"Generic Owner"},{"label":"Guidewire IT - 4RPU Classes Services","value":"006a000001LMM6iAAH"},{"label":"Guidewire Software, Inc.","value":"001a000001bIBUaAAO"},{"label":"USD 50,000.00","value":{"amount":50000,"currency":"USD"}},{"label":"MORKE12","value":"005a000000Ck6jHAAR"},{"label":"Kevin Morgan","value":"005a000000Ck6jHAAR"},{"label":"Daniel Cooper","value":"005a000000COjMEAA1"},{"label":"100% - Contract Signed","value":"100% - Contract Signed"},{"label":"Services","value":"Services"},{"label":"Agile Central","value":"Agile Central"},{"label":"10/17/2016","value":"2016-10-17"}]},{"dataCells":[{"label":"898004","value":"898004"},{"label":"NA","value":"NA"},{"label":"Platinum","value":"Platinum"},{"label":"PLAT_SE","value":"PLAT_SE"},{"label":"PLAT_SE_ATLANTA","value":"PLAT_SE_ATLANTA"},{"label":"US - UNITED STATES","value":"US - UNITED STATES"},{"label":"RIVEL01","value":"00530000000whJUAAY"},{"label":"Ellianne Rivers","value":"Ellianne Rivers"},{"label":"Travelport Business User Identity Portal","value":"006a000000zOqykAAC"},{"label":"Travelport Limited","value":"0013000000KQZGbAAP"},{"label":"USD 48,000.00","value":{"amount":48000,"currency":"USD"}},{"label":"RIVEL01","value":"00530000000whJUAAY"},{"label":"Ellianne Rivers","value":"00530000000whJUAAY"},{"label":"Michael Molloy","value":"00530000000whJgAAI"},{"label":"100% - Contract Signed","value":"100% - Contract Signed"},{"label":"PNCV","value":"PNCV"},{"label":"Security","value":"Security"},{"label":"10/13/2016","value":"2016-10-13"}]},{"dataCells":[{"label":"876648","value":"876648"},{"label":"EMEA","value":"EMEA"},{"label":"STH","value":"STH"},{"label":"MIDIS","value":"MIDIS"},{"label":"TURKEY","value":"TURKEY"},{"label":"TR - TURKEY","value":"TR - TURKEY"},{"label":"Gowner","value":"00530000006ca0qAAA"},{"label":"Generic Owner","value":"Generic Owner"},{"label":"TFKB-API Portal","value":"006a000001JOuPbAAL"},{"label":"NATIONAL COMMERCIAL BANK","value":"001a000001J6bptAAB"},{"label":"USD 45,082.08","value":{"amount":45082.08,"currency":"USD"}},{"label":"GULUM01","value":"005a0000007qoe1AAA"},{"label":"Umut Guler","value":"005a0000007qoe1AAA"},{"label":"Levent Sensezgin","value":"005a0000007rJJHAA2"},{"label":"100% - Contract Signed","value":"100% - Contract Signed"},{"label":"PNCV","value":"PNCV"},{"label":"API Management","value":"API Management"},{"label":"10/17/2016","value":"2016-10-17"}]},{"dataCells":[{"label":"890971","value":"890971"},{"label":"NA","value":"NA"},{"label":"Platinum","value":"Platinum"},{"label":"PLAT_NE","value":"PLAT_NE"},{"label":"PLAT_NE_NY","value":"PLAT_NE_NY"},{"label":"US - UNITED STATES","value":"US - UNITED STATES"},{"label":"MAIST01","value":"005a0000009diNgAAI"},{"label":"Stephen Maillard","value":"Stephen Maillard"},{"label":"Security - Data Protection Services","value":"006a000001KH0gtAAD"},{"label":"The McGraw-Hill Companies Inc","value":"0013000000HQY6LAAX"},{"label":"USD 43,200.00","value":{"amount":43200,"currency":"USD"}},{"label":"MAIST01","value":"005a0000009diNgAAI"},{"label":"Stephen Maillard","value":"005a0000009diNgAAI"},{"label":"Omar Lopez","value":"00530000001bUWQAA2"},{"label":"100% - Contract Signed","value":"100% - Contract Signed"},{"label":"Services","value":"Services"},{"label":"Security","value":"Security"},{"label":"10/11/2016","value":"2016-10-11"}]},{"dataCells":[{"label":"856351","value":"856351"},{"label":"APJ","value":"APJ"},{"label":"ANZ","value":"ANZ"},{"label":"AUSTRALIA","value":"AUSTRALIA"},{"label":"AUSTRALIA","value":"AUSTRALIA"},{"label":"AU - AUSTRALIA","value":"AU - AUSTRALIA"},{"label":"Gowner","value":"00530000006ca0qAAA"},{"label":"Generic Owner","value":"Generic Owner"},{"label":"Business Consulting","value":"006a000001IEbCcAAL"},{"label":"BT Australia","value":"001a000001fehTOAAY"},{"label":"USD 43,001.71","value":{"amount":43001.7119941732680247895221826410197443,"currency":"USD"}},{"label":"RICPE04","value":"005a000000C10xbAAB"},{"label":"Peter Rice","value":"005a000000C10xbAAB"},{"label":"Mark Metcalf","value":"00530000003ov8jAAA"},{"label":"100% - Contract Signed","value":"100% - Contract Signed"},{"label":"Services","value":"Services"},{"label":"Other","value":"Other"},{"label":"10/11/2016","value":"2016-10-11"}]},{"dataCells":[{"label":"898660","value":"898660"},{"label":"EMEA","value":"EMEA"},{"label":"NTH","value":"NTH"},{"label":"NORWAY","value":"NORWAY"},{"label":"NORWAY","value":"NORWAY"},{"label":"NO - NORWAY","value":"NO - NORWAY"},{"label":"TAUEI01","value":"00530000000wiIcAAI"},{"label":"Eirik Taule","value":"Eirik Taule"},{"label":"Telenor Norge, Canal Digital KTV, Services","value":"006a000000zP3A3AAK"},{"label":"Telenor ASA","value":"0013000000HabwAAAR"},{"label":"USD 42,315.00","value":{"amount":42314.99999938220100000901986539986831,"currency":"USD"}},{"label":"TAUEI01","value":"00530000000wiIcAAI"},{"label":"Eirik Taule","value":"00530000000wiIcAAI"},{"label":"Tore Nilsen","value":"00530000001b4qUAAQ"},{"label":"100% - Contract Signed","value":"100% - Contract Signed"},{"label":"Services","value":"Services"},{"label":"Service Management","value":"Service Management"},{"label":"10/11/2016","value":"2016-10-11"}]},{"dataCells":[{"label":"903254","value":"903254"},{"label":"NA","value":"NA"},{"label":"Platinum","value":"Platinum"},{"label":"PLAT_SE","value":"PLAT_SE"},{"label":"PLAT_SE_CAROLINAS","value":"PLAT_SE_CAROLINAS"},{"label":"US - UNITED STATES","value":"US - UNITED STATES"},{"label":"CAMMA14","value":"00530000000whJ4AAI"},{"label":"Mark Campbell","value":"Mark Campbell"},{"label":"TIAA--PPM--Services--Report Conversion","value":"006a000001LM2niAAD"},{"label":"Teachers Insurance and Annuity Association of America","value":"0013000000HQYA3AAP"},{"label":"USD 41,900.00","value":{"amount":41900,"currency":"USD"}},{"label":"BUZJO02","value":"005a000000BnyLPAAZ"},{"label":"Joseph Buzitsky","value":"005a000000BnyLPAAZ"},{"label":"James McDonald","value":"00530000000whO8AAI"},{"label":"100% - Contract Signed","value":"100% - Contract Signed"},{"label":"Services","value":"Services"},{"label":"PPM","value":"PPM"},{"label":"10/14/2016","value":"2016-10-14"}]},{"dataCells":[{"label":"894579","value":"894579"},{"label":"NA","value":"NA"},{"label":"Named/Growth","value":"Named/Growth"},{"label":"NG_NE","value":"NG_NE"},{"label":"NG_NE_NAMED","value":"NG_NE_NAMED"},{"label":"US - UNITED STATES","value":"US - UNITED STATES"},{"label":"Gowner","value":"00530000006ca0qAAA"},{"label":"Generic Owner","value":"Generic Owner"},{"label":"Boehringer-AMS 3 Months Phase 2","value":"006a000000zRxOsAAK"},{"label":"Boehringer Ingelheim","value":"0013000000HQXeMAAX"},{"label":"USD 41,460.00","value":{"amount":41460,"currency":"USD"}},{"label":"DAUAN02","value":"005a000000BnhJGAAZ"},{"label":"Anthony D'Aurora","value":"005a000000BnhJGAAZ"},{"label":"James Stemme","value":"005a000000AyTmEAAV"},{"label":"100% - Contract Signed","value":"100% - Contract Signed"},{"label":"Services","value":"Services"},{"label":"Enterprise Management","value":"Enterprise Management"},{"label":"10/4/2016","value":"2016-10-04"}]},{"dataCells":[{"label":"894399","value":"894399"},{"label":"NA","value":"NA"},{"label":"Named/Growth","value":"Named/Growth"},{"label":"NG_NE","value":"NG_NE"},{"label":"NG_NE_GROWTH","value":"NG_NE_GROWTH"},{"label":"US - UNITED STATES","value":"US - UNITED STATES"},{"label":"Gowner","value":"00530000006ca0qAAA"},{"label":"Generic Owner","value":"Generic Owner"},{"label":"SDI - CA WA AE Lite Promo","value":"006a000000zRuG7AAK"},{"label":"Sdi Holdings LLC","value":"001a000001J6YJMAA3"},{"label":"USD 40,000.00","value":{"amount":40000,"currency":"USD"}},{"label":"AUWMA01","value":"005a000000AWOexAAH"},{"label":"Matthew Auwarter","value":"005a000000AWOexAAH"},{"label":"Dianne Murtha-Fitzpatrick","value":"005300000017Q8CAAU"},{"label":"100% - Contract Signed","value":"100% - Contract Signed"},{"label":"PNCV","value":"PNCV"},{"label":"Workload Automation","value":"Workload Automation"},{"label":"10/10/2016","value":"2016-10-10"}]},{"dataCells":[{"label":"884394","value":"884394"},{"label":"EMEA","value":"EMEA"},{"label":"STH","value":"STH"},{"label":"ISRAEL","value":"ISRAEL"},{"label":"ISRAEL","value":"ISRAEL"},{"label":"IL - ISRAEL","value":"IL - ISRAEL"},{"label":"Gowner","value":"00530000006ca0qAAA"},{"label":"Generic Owner","value":"Generic Owner"},{"label":"Bank Leumi-ERwin-Renewal","value":"006a000001K47DVAAZ"},{"label":"BANK LEUMI LE-ISRAEL LTD.","value":"0013000000HabuFAAR"},{"label":"USD 38,815.00","value":{"amount":38815,"currency":"USD"}},{"label":"MARAA03","value":"005a000000Ck2JZAAZ"},{"label":"Aaron Norberto Martinez Galicia","value":"005a000000Ck2JZAAZ"},{"label":"James Anagnostopoulos","value":"00530000004LkK7AAK"},{"label":"100% - Contract Signed","value":"100% - Contract Signed"},{"label":"PNCV","value":"PNCV"},{"label":"Erwin","value":"Erwin"},{"label":"10/14/2016","value":"2016-10-14"}]},{"dataCells":[{"label":"878188","value":"878188"},{"label":"NA","value":"NA"},{"label":"Platinum","value":"Platinum"},{"label":"PLAT_CENTRAL","value":"PLAT_CENTRAL"},{"label":"PLAT_CENTRAL_MIDWEST","value":"PLAT_CENTRAL_MIDWEST"},{"label":"US - UNITED STATES","value":"US - UNITED STATES"},{"label":"BAGCR01","value":"005a0000009M5R7AAK"},{"label":"Craig Baglien","value":"Craig Baglien"},{"label":"Country USS and Catalog services","value":"006a000001JPvY6AAL"},{"label":"Country Companies","value":"00130000016tQyXAAU"},{"label":"USD 38,205.00","value":{"amount":38205,"currency":"USD"}},{"label":"BAGCR01","value":"005a0000009M5R7AAK"},{"label":"Craig Baglien","value":"005a0000009M5R7AAK"},{"label":"Nona Schwabe","value":"00530000003oNyvAAE"},{"label":"100% - Contract Signed","value":"100% - Contract Signed"},{"label":"Services","value":"Services"},{"label":"Service Management","value":"Service Management"},{"label":"10/4/2016","value":"2016-10-04"}]},{"dataCells":[{"label":"891349","value":"891349"},{"label":"EMEA","value":"EMEA"},{"label":"STH","value":"STH"},{"label":"IBERIA","value":"IBERIA"},{"label":"SPAIN","value":"SPAIN"},{"label":"ES - SPAIN","value":"ES - SPAIN"},{"label":"Gowner","value":"00530000006ca0qAAA"},{"label":"Generic Owner","value":"Generic Owner"},{"label":"MUTUA MADRILEA -- App Synthetic Monitor","value":"006a000001KH8NGAA1"},{"label":"MUTUA MADRILEA","value":"0013000000dg2GXAAY"},{"label":"USD 35,541.83","value":{"amount":35541.8339258288607638359331652690930391,"currency":"USD"}},{"label":"GRAIN02","value":"005300000044vQMAAY"},{"label":"Inmaculada Granado","value":"005300000044vQMAAY"},{"label":"Valentin Galan","value":"00530000001c1G0AAI"},{"label":"100% - Contract Signed","value":"100% - Contract Signed"},{"label":"PNCV","value":"PNCV"},{"label":"Enterprise Management","value":"Enterprise Management"},{"label":"10/14/2016","value":"2016-10-14"}]},{"dataCells":[{"label":"871324","value":"871324"},{"label":"EMEA","value":"EMEA"},{"label":"CEN","value":"CEN"},{"label":"SWITZERLAND","value":"SWITZERLAND"},{"label":"SWITZERLAND","value":"SWITZERLAND"},{"label":"CH - SWITZERLAND","value":"CH - SWITZERLAND"},{"label":"Gowner","value":"00530000006ca0qAAA"},{"label":"Generic Owner","value":"Generic Owner"},{"label":"Acentix / Abraxas Informatik AG MT 01 Oct 2016 (Indirect)","value":"006a000001JO3kbAAD"},{"label":"Abraxas Informatik AG","value":"001a000001J6cLPAAZ"},{"label":"USD 35,212.42","value":{"amount":35212.4244549301008234103776125108548319,"currency":"USD"}},{"label":"PLEJE01","value":"00530000000wiVxAAI"},{"label":"Jeannetta Plesky","value":"00530000000wiVxAAI"},{"label":"Rupert Emmett","value":"00530000000wqVlAAI"},{"label":"100% - Contract Signed","value":"100% - Contract Signed"},{"label":"Renewal w/Products","value":"Renewal w/Products"},{"label":"Enterprise Management","value":"Enterprise Management"},{"label":"10/1/2016","value":"2016-10-01"}]},{"dataCells":[{"label":"898048","value":"898048"},{"label":"NA","value":"NA"},{"label":"Public Sector/Canada","value":"Public Sector/Canada"},{"label":"PS_FED/FSI","value":"PS_FED/FSI"},{"label":"PS_FSI","value":"PS_FSI"},{"label":"US - UNITED STATES","value":"US - UNITED STATES"},{"label":"BOYJA08","value":"00530000000whCvAAI"},{"label":"James Boykin","value":"James Boykin"},{"label":"Xceedium  AMI for AWS Subscription","value":"006a000000zOrntAAC"},{"label":"NORTHROP GRUMMAN","value":"0013000000HQXzFAAX"},{"label":"USD 35,119.67","value":{"amount":35119.67,"currency":"USD"}},{"label":"BAIMA07","value":"005300000016r3CAAQ"},{"label":"Mark Bailey","value":"005300000016r3CAAQ"},{"label":"Mark Mortimer","value":"00530000000whQNAAY"},{"label":"100% - Contract Signed","value":"100% - Contract Signed"},{"label":"Renewal w/Products","value":"Renewal w/Products"},{"label":"Security","value":"Security"},{"label":"10/17/2016","value":"2016-10-17"}]},{"dataCells":[{"label":"764463","value":"764463"},{"label":"EMEA","value":"EMEA"},{"label":"FRA","value":"FRA"},{"label":"FRANCE","value":"FRANCE"},{"label":"FRANCE","value":"FRANCE"},{"label":"FR - FRANCE","value":"FR - FRANCE"},{"label":"Gowner","value":"00530000006ca0qAAA"},{"label":"Generic Owner","value":"Generic Owner"},{"label":"Auchan - Spectrum Migration","value":"006a000001BihWPAAZ"},{"label":"GROUPE MULLIEZ","value":"0013000000HabwsAAB"},{"label":"USD 34,140.00","value":{"amount":34140.0000055989600009182294401505896282,"currency":"USD"}},{"label":"RAVVI02","value":"005a000000Bv1RvAAJ"},{"label":"Vincent Ravel","value":"005a000000Bv1RvAAJ"},{"label":"Florian Sellem","value":"005a000000BBmv8AAD"},{"label":"100% - Contract Signed","value":"100% - Contract Signed"},{"label":"Services","value":"Services"},{"label":"Enterprise Management","value":"Enterprise Management"},{"label":"10/12/2016","value":"2016-10-12"}]},{"dataCells":[{"label":"903222","value":"903222"},{"label":"EMEA","value":"EMEA"},{"label":"UKI","value":"UKI"},{"label":"UKI","value":"UKI"},{"label":"UK","value":"UK"},{"label":"IE - IRELAND","value":"IE - IRELAND"},{"label":"Gowner","value":"00530000006ca0qAAA"},{"label":"Generic Owner","value":"Generic Owner"},{"label":"BOI Consultancy Extension","value":"006a000001LM2dTAAT"},{"label":"BANK OF IRELAND","value":"0013000000XHgPQAA1"},{"label":"USD 33,571.00","value":{"amount":33571.000005505644000902925616148079801,"currency":"USD"}},{"label":"MELGA02","value":"0053000000160aPAAQ"},{"label":"Gary Mellows","value":"0053000000160aPAAQ"},{"label":"Prakash Vyas","value":"005a000000BE5JKAA1"},{"label":"100% - Contract Signed","value":"100% - Contract Signed"},{"label":"Services","value":"Services"},{"label":"PPM","value":"PPM"},{"label":"10/13/2016","value":"2016-10-13"}]},{"dataCells":[{"label":"815512","value":"815512"},{"label":"NA","value":"NA"},{"label":"Public Sector/Canada","value":"Public Sector/Canada"},{"label":"PS_SLED","value":"PS_SLED"},{"label":"PS_SL-EAST","value":"PS_SL-EAST"},{"label":"US - UNITED STATES","value":"US - UNITED STATES"},{"label":"GERJE07","value":"005a000000CQz6eAAD"},{"label":"Jeffrey Gerhart","value":"Jeffrey Gerhart"},{"label":"HOWARD COUNTY- DE Lite","value":"006a000001EeTy2AAF"},{"label":"MARYLAND - LOCAL","value":"0013000000HQXjKAAX"},{"label":"USD 32,000.00","value":{"amount":32000,"currency":"USD"}},{"label":"KELBR10","value":"005a000000B5wxpAAB"},{"label":"Brian Kelley","value":"005a000000B5wxpAAB"},{"label":"Dianne Murtha-Fitzpatrick","value":"005300000017Q8CAAU"},{"label":"100% - Contract Signed","value":"100% - Contract Signed"},{"label":"PNCV","value":"PNCV"},{"label":"Workload Automation","value":"Workload Automation"},{"label":"10/5/2016","value":"2016-10-05"}]},{"dataCells":[{"label":"901300","value":"901300"},{"label":"EMEA","value":"EMEA"},{"label":"STH","value":"STH"},{"label":"ITALY","value":"ITALY"},{"label":"ITALY","value":"ITALY"},{"label":"IT - ITALY","value":"IT - ITALY"},{"label":"Gowner","value":"00530000006ca0qAAA"},{"label":"Generic Owner","value":"Generic Owner"},{"label":"SIA - SERVICES - Integrazione SDM con tool IAG","value":"006a000001LLi6SAAT"},{"label":"SIA SPA","value":"0013000000HabulAAB"},{"label":"USD 31,864.00","value":{"amount":31864.0000052256960008570141441405503196,"currency":"USD"}},{"label":"CLAFI01","value":"005300000019H7yAAE"},{"label":"Fiorenzo Claus","value":"005300000019H7yAAE"},{"label":"Alessandro Furlani","value":"005300000019ms5AAA"},{"label":"100% - Contract Signed","value":"100% - Contract Signed"},{"label":"Services","value":"Services"},{"label":"Service Management","value":"Service Management"},{"label":"10/13/2016","value":"2016-10-13"}]},{"dataCells":[{"label":"868443","value":"868443"},{"label":"EMEA","value":"EMEA"},{"label":"CEN","value":"CEN"},{"label":"AUSTRIA","value":"AUSTRIA"},{"label":"AUSTRIA","value":"AUSTRIA"},{"label":"AT - AUSTRIA","value":"AT - AUSTRIA"},{"label":"GRAGE04","value":"005a000000BnGTuAAN"},{"label":"Gernot Gradischnig","value":"Gernot Gradischnig"},{"label":"APM+Onsite+Education+Comparex","value":"006a000001IlYXwAAN"},{"label":"Raiffeisen e-force GmbH","value":"0013000000HabwIAAR"},{"label":"USD 30,555.30","value":{"amount":30555.3000050110692008218153489347777172,"currency":"USD"}},{"label":"DERTA01","value":"005a000000BneY8AAJ"},{"label":"Taimaz Derakhshan","value":"005a000000BneY8AAJ"},{"label":"Steve Macfarlane","value":"005300000015fKLAAY"},{"label":"100% - Contract Signed","value":"100% - Contract Signed"},{"label":"Standalone Education","value":"Standalone Education"},{"label":"Enterprise Management","value":"Enterprise Management"},{"label":"10/10/2016","value":"2016-10-10"}]},{"dataCells":[{"label":"900398","value":"900398"},{"label":"EMEA","value":"EMEA"},{"label":"NTH","value":"NTH"},{"label":"SWEDEN","value":"SWEDEN"},{"label":"SWEDEN","value":"SWEDEN"},{"label":"SE - SWEDEN","value":"SE - SWEDEN"},{"label":"ANDNI05","value":"005a000000B73fHAAR"},{"label":"Niklas Andrae","value":"Niklas Andrae"},{"label":"PoC work for Project one Pager","value":"006a000001LLbf4AAD"},{"label":"Ericsson AB","value":"0013000000HabydAAB"},{"label":"USD 30,400.00","value":{"amount":30400,"currency":"USD"}},{"label":"VILPA05","value":"00530000005U8KrAAK"},{"label":"Pasi Vilen","value":"00530000005U8KrAAK"},{"label":"Odd Heimstad","value":"0053000000160XMAAY"},{"label":"100% - Contract Signed","value":"100% - Contract Signed"},{"label":"Services","value":"Services"},{"label":"PPM","value":"PPM"},{"label":"10/11/2016","value":"2016-10-11"}]},{"dataCells":[{"label":"902881","value":"902881"},{"label":"EMEA","value":"EMEA"},{"label":"NTH","value":"NTH"},{"label":"NORWAY","value":"NORWAY"},{"label":"NORWAY","value":"NORWAY"},{"label":"NO - NORWAY","value":"NO - NORWAY"},{"label":"Gowner","value":"00530000006ca0qAAA"},{"label":"Generic Owner","value":"Generic Owner"},{"label":"COOP Norge Spectrum Education","value":"006a000001LM0V3AAL"},{"label":"Coop Norge Sa","value":"0013000000HasMDAAZ"},{"label":"USD 30,225.00","value":{"amount":30224.9999995587150000064427609999059357,"currency":"USD"}},{"label":"LAGTI02","value":"00530000000wiF2AAI"},{"label":"Tina Lagercrantz","value":"00530000000wiF2AAI"},{"label":"Steve Macfarlane","value":"005300000015fKLAAY"},{"label":"100% - Contract Signed","value":"100% - Contract Signed"},{"label":"Standalone Education","value":"Standalone Education"},{"label":"Enterprise Management","value":"Enterprise Management"},{"label":"10/4/2016","value":"2016-10-04"}]},{"dataCells":[{"label":"897612","value":"897612"},{"label":"NA","value":"NA"},{"label":"Named/Growth","value":"Named/Growth"},{"label":"NG_WEST","value":"NG_WEST"},{"label":"NG_WEST_NAMED","value":"NG_WEST_NAMED"},{"label":"US - UNITED STATES","value":"US - UNITED STATES"},{"label":"Gowner","value":"00530000006ca0qAAA"},{"label":"Generic Owner","value":"Generic Owner"},{"label":"Dexcom - GD PWP DocBoss","value":"006a000000zOk61AAC"},{"label":"Dexcom","value":"001a000001bK1iXAAS"},{"label":"USD 28,650.00","value":{"amount":28650,"currency":"USD"}},{"label":"BABNI02","value":"005a000000B6VA0AAN"},{"label":"Ninos Baba","value":"005a000000B6VA0AAN"},{"label":"Brian D Trotta","value":"00530000001qePEAAY"},{"label":"100% - Contract Signed","value":"100% - Contract Signed"},{"label":"Services","value":"Services"},{"label":"PPM","value":"PPM"},{"label":"10/4/2016","value":"2016-10-04"}]},{"dataCells":[{"label":"902737","value":"902737"},{"label":"LA","value":"LA"},{"label":"ANDEAN","value":"ANDEAN"},{"label":"ANDEAN - NORTH","value":"ANDEAN - NORTH"},{"label":"VENEZUELA","value":"VENEZUELA"},{"label":"VE - VENEZUELA","value":"VE - VENEZUELA"},{"label":"Gowner","value":"00530000006ca0qAAA"},{"label":"Generic Owner","value":"Generic Owner"},{"label":"NetReady For CAW FY17","value":"006a000001LM0EqAAL"},{"label":"Soluciones Netready.com CA","value":"0013000000dhPIMAA2"},{"label":"USD 28,470.00","value":{"amount":28469.9999848512599991213730799490396386,"currency":"USD"}},{"label":"MARCA21","value":"005a000000BDn2tAAD"},{"label":"Carlos Marcantoni","value":"005a000000BDn2tAAD"},{"label":"Fernando Ramirez","value":"00530000000wiAoAAI"},{"label":"100% - Contract Signed","value":"100% - Contract Signed"},{"label":"Standalone Education","value":"Standalone Education"},{"label":"Other","value":"Other"},{"label":"10/4/2016","value":"2016-10-04"}]},{"dataCells":[{"label":"897767","value":"897767"},{"label":"APJ","value":"APJ"},{"label":"ANZ","value":"ANZ"},{"label":"AUSTRALIA","value":"AUSTRALIA"},{"label":"AUSTRALIA","value":"AUSTRALIA"},{"label":"AU - AUSTRALIA","value":"AU - AUSTRALIA"},{"label":"SPEJO01","value":"005300000015cdKAAQ"},{"label":"John Speidel","value":"John Speidel"},{"label":"Landcorp Extended Support","value":"006a000000zOnGEAA0"},{"label":"WESTERN AUSTRALIAN LAND AUTHORITY","value":"00130000014MetkAAC"},{"label":"USD 26,799.50","value":{"amount":26799.4999963686677504920455198083278321,"currency":"USD"}},{"label":"SPEJO01","value":"005300000015cdKAAQ"},{"label":"John Speidel","value":"005300000015cdKAAQ"},{"label":"Ivan Lobo","value":"0053000000533lAAAQ"},{"label":"100% - Contract Signed","value":"100% - Contract Signed"},{"label":"Support","value":"Support"},{"label":"PPM","value":"PPM"},{"label":"10/4/2016","value":"2016-10-04"}]},{"dataCells":[{"label":"892294","value":"892294"},{"label":"LA","value":"LA"},{"label":"ANDEAN","value":"ANDEAN"},{"label":"ANDEAN - NORTH","value":"ANDEAN - NORTH"},{"label":"COLOMBIA","value":"COLOMBIA"},{"label":"CO - COLOMBIA","value":"CO - COLOMBIA"},{"label":"LA_PARTN","value":"00530000006cIJ2AAM"},{"label":"LA PARTNER","value":"LA PARTNER"},{"label":"Getronics Xrtraction for Comfandi","value":"006a000000zRihrAAC"},{"label":"Getronics Colombia Ltda","value":"0013000000pF647AAC"},{"label":"USD 26,040.00","value":{"amount":26040,"currency":"USD"}},{"label":"MORMA43","value":"005300000069rH9AAI"},{"label":"Mario Fernando Morales","value":"005300000069rH9AAI"},{"label":"Fernando Ramirez","value":"00530000000wiAoAAI"},{"label":"100% - Contract Signed","value":"100% - Contract Signed"},{"label":"PNCV","value":"PNCV"},{"label":"Service Management","value":"Service Management"},{"label":"10/1/2016","value":"2016-10-01"}]},{"dataCells":[{"label":"886530","value":"886530"},{"label":"NA","value":"NA"},{"label":"Platinum","value":"Platinum"},{"label":"PLAT_CENTRAL","value":"PLAT_CENTRAL"},{"label":"PLAT_CENTRAL_NORTH","value":"PLAT_CENTRAL_NORTH"},{"label":"US - UNITED STATES","value":"US - UNITED STATES"},{"label":"HOAJO01","value":"00530000007O5WxAAK"},{"label":"John Hoagland","value":"John Hoagland"},{"label":"Ecolab -MR OL1801795 (15) WE CC","value":"006a000001KGCsVAAX"},{"label":"Ecolab Inc.","value":"0013000000HQXlNAAX"},{"label":"USD 25,972.65","value":{"amount":25972.65,"currency":"USD"}},{"label":"FARJO17","value":"005a000000CQqIAAA1"},{"label":"Joseph Farruggia","value":"005a000000CQqIAAA1"},{"label":"Thomas Knowland","value":"005a000000CQqH2AAL"},{"label":"100% - Contract Signed","value":"100% - Contract Signed"},{"label":"PNCV","value":"PNCV"},{"label":"Erwin","value":"Erwin"},{"label":"10/7/2016","value":"2016-10-07"}]},{"dataCells":[{"label":"897871","value":"897871"},{"label":"NA","value":"NA"},{"label":"Platinum","value":"Platinum"},{"label":"PLAT_CENTRAL","value":"PLAT_CENTRAL"},{"label":"PLAT_CENTRAL_MIDWEST","value":"PLAT_CENTRAL_MIDWEST"},{"label":"US - UNITED STATES","value":"US - UNITED STATES"},{"label":"PERRO09","value":"00530000000whAbAAI"},{"label":"Robert Perry","value":"Robert Perry"},{"label":"Discover - SiteMinder Health Check","value":"006a000000zOobNAAS"},{"label":"Discover Financial Services","value":"0013000000HQXkWAAX"},{"label":"USD 25,344.00","value":{"amount":25344,"currency":"USD"}},{"label":"PERRO09","value":"00530000000whAbAAI"},{"label":"Robert Perry","value":"00530000000whAbAAI"},{"label":"Nona Schwabe","value":"00530000003oNyvAAE"},{"label":"100% - Contract Signed","value":"100% - Contract Signed"},{"label":"Services","value":"Services"},{"label":"Security","value":"Security"},{"label":"10/12/2016","value":"2016-10-12"}]},{"dataCells":[{"label":"888128","value":"888128"},{"label":"NA","value":"NA"},{"label":"Public Sector/Canada","value":"Public Sector/Canada"},{"label":"PS_CANADA","value":"PS_CANADA"},{"label":"PS_CAN_FED-EAST","value":"PS_CAN_FED-EAST"},{"label":"CA - CANADA","value":"CA - CANADA"},{"label":"LEPAN02","value":"005a0000009M5QxAAK"},{"label":"Antonio Lepanto","value":"Antonio Lepanto"},{"label":"CBC  APIM Health Check - 888128","value":"006a000001KGZyPAAX"},{"label":"CBC/Radio-Canada","value":"001a000001NhHIzAAN"},{"label":"USD 24,608.00","value":{"amount":24608.0000006644160000179392320004843593,"currency":"USD"}},{"label":"LEPAN02","value":"005a0000009M5QxAAK"},{"label":"Antonio Lepanto","value":"005a0000009M5QxAAK"},{"label":"George Vesnaver","value":"005a000000CQtDtAAL"},{"label":"100% - Contract Signed","value":"100% - Contract Signed"},{"label":"Services","value":"Services"},{"label":"API Management","value":"API Management"},{"label":"10/17/2016","value":"2016-10-17"}]},{"dataCells":[{"label":"865436","value":"865436"},{"label":"EMEA","value":"EMEA"},{"label":"NTH","value":"NTH"},{"label":"SWEDEN","value":"SWEDEN"},{"label":"SWEDEN","value":"SWEDEN"},{"label":"SE - SWEDEN","value":"SE - SWEDEN"},{"label":"LUNKI01","value":"00530000005pfpQAAQ"},{"label":"Kim Lunden","value":"Kim Lunden"},{"label":"Sandvik - ITAM Services","value":"006a000001IwJR9AAN"},{"label":"SANDVIK AB","value":"0013000000HabyTAAR"},{"label":"USD 24,105.78","value":{"amount":24105.7757504695805116191474283663409919,"currency":"USD"}},{"label":"LUNKI01","value":"00530000005pfpQAAQ"},{"label":"Kim Lunden","value":"00530000005pfpQAAQ"},{"label":"Anders Tornqvist","value":"00530000007KD3JAAW"},{"label":"100% - Contract Signed","value":"100% - Contract Signed"},{"label":"Services","value":"Services"},{"label":"Service Management","value":"Service Management"},{"label":"10/4/2016","value":"2016-10-04"}]},{"dataCells":[{"label":"866029","value":"866029"},{"label":"NA","value":"NA"},{"label":"Platinum","value":"Platinum"},{"label":"PLAT_CENTRAL","value":"PLAT_CENTRAL"},{"label":"PLAT_CENTRAL_NORTH","value":"PLAT_CENTRAL_NORTH"},{"label":"US - UNITED STATES","value":"US - UNITED STATES"},{"label":"BACCO02","value":"005a0000009dGNMAA2"},{"label":"Cory Bach","value":"Cory Bach"},{"label":"Supplementary Support AMERIPRISE FINANCIAL, INC.","value":"006a000001IwfTlAAJ"},{"label":"Ameriprise Financial, Inc.","value":"0013000000HQXaiAAH"},{"label":"USD 23,897.00","value":{"amount":23897,"currency":"USD"}},{"label":"WAWVI01","value":"00530000004fnCzAAI"},{"label":"Victor W Rie","value":"00530000004fnCzAAI"},{"label":"Mark Mortimer","value":"00530000000whQNAAY"},{"label":"100% - Contract Signed","value":"100% - Contract Signed"},{"label":"Services","value":"Services"},{"label":"N/A","value":"N/A"},{"label":"10/17/2016","value":"2016-10-17"}]},{"dataCells":[{"label":"910536","value":"910536"},{"label":"EMEA","value":"EMEA"},{"label":"STH","value":"STH"},{"label":"ITALY","value":"ITALY"},{"label":"ITALY","value":"ITALY"},{"label":"IT - ITALY","value":"IT - ITALY"},{"label":"Gowner","value":"00530000006ca0qAAA"},{"label":"Generic Owner","value":"Generic Owner"},{"label":"Banco Popolare assistenza","value":"006a000001LMNBVAA5"},{"label":"SOCIETA' GESTIONE SERVIZI BP SOCIETA' CONSORTILE PER AZIONI","value":"0013000000HabugAAB"},{"label":"USD 23,471.25","value":{"amount":23471.2500038492850006312827401035303694,"currency":"USD"}},{"label":"CARFA01","value":"00530000000wiHXAAY"},{"label":"Fabio Carrozzo","value":"00530000000wiHXAAY"},{"label":"Michele Lamartina","value":"005a000000BESUJAA5"},{"label":"100% - Contract Signed","value":"100% - Contract Signed"},{"label":"Services","value":"Services"},{"label":"Security","value":"Security"},{"label":"10/17/2016","value":"2016-10-17"}]},{"dataCells":[{"label":"882412","value":"882412"},{"label":"EMEA","value":"EMEA"},{"label":"NTH","value":"NTH"},{"label":"SWEDEN","value":"SWEDEN"},{"label":"SWEDEN","value":"SWEDEN"},{"label":"SE - SWEDEN","value":"SE - SWEDEN"},{"label":"Gowner","value":"00530000006ca0qAAA"},{"label":"Generic Owner","value":"Generic Owner"},{"label":"Scania CR#3 Services","value":"006a000001JR9TMAA1"},{"label":"Scania AB","value":"0013000000HabyxAAB"},{"label":"USD 23,246.94","value":{"amount":23246.9440004528504691288215271386294433,"currency":"USD"}},{"label":"ELLRO05","value":"005a000000AvKgVAAV"},{"label":"Robert Elliot","value":"005a000000AvKgVAAV"},{"label":"Timothy Smithson","value":"005a000000BDpztAAD"},{"label":"100% - Contract Signed","value":"100% - Contract Signed"},{"label":"Services","value":"Services"},{"label":"PPM","value":"PPM"},{"label":"10/12/2016","value":"2016-10-12"}]},{"dataCells":[{"label":"851744","value":"851744"},{"label":"APJ","value":"APJ"},{"label":"KOREA","value":"KOREA"},{"label":"KOREA","value":"KOREA"},{"label":"KOREA, REPUBLIC OF","value":"KOREA, REPUBLIC OF"},{"label":"KR - KOREA, REPUBLIC OF","value":"KR - KOREA, REPUBLIC OF"},{"label":"JANJA05","value":"005a000000AusSTAAZ"},{"label":"Jaeho Jang","value":"Jaeho Jang"},{"label":"SAMSUNG ELECTRONICS-ERwin-KR-NCV","value":"006a000001HZQ27AAH"},{"label":"SAMSUNG ELECTRONICS","value":"0013000000HRMiFAAX"},{"label":"USD 23,000.00","value":{"amount":23000,"currency":"USD"}},{"label":"HONSU03","value":"005a000000Ck3gAAAR"},{"label":"Sung Gun Hong","value":"005a000000Ck3gAAAR"},{"label":"James Anagnostopoulos","value":"00530000004LkK7AAK"},{"label":"100% - Contract Signed","value":"100% - Contract Signed"},{"label":"PNCV","value":"PNCV"},{"label":"Erwin","value":"Erwin"},{"label":"10/4/2016","value":"2016-10-04"}]},{"dataCells":[{"label":"901401","value":"901401"},{"label":"EMEA","value":"EMEA"},{"label":"NTH","value":"NTH"},{"label":"NETHERLANDS","value":"NETHERLANDS"},{"label":"NETHERLANDS","value":"NETHERLANDS"},{"label":"NL - NETHERLANDS","value":"NL - NETHERLANDS"},{"label":"Gowner","value":"00530000006ca0qAAA"},{"label":"Generic Owner","value":"Generic Owner"},{"label":"Gemeente Haarlemmermeer|API Management","value":"006a000001LLkqTAAT"},{"label":"Gemeente Haarlemmermeer","value":"001a000001mbOHZAA2"},{"label":"USD 22,032.82","value":{"amount":22032.8180036133821525925946730251855264,"currency":"USD"}},{"label":"VELRO02","value":"00530000003NBrXAAW"},{"label":"Roger Veldpaus","value":"00530000003NBrXAAW"},{"label":"Niels Beckers","value":"005300000019aZ6AAI"},{"label":"100% - Contract Signed","value":"100% - Contract Signed"},{"label":"PNCV","value":"PNCV"},{"label":"API Management","value":"API Management"},{"label":"10/10/2016","value":"2016-10-10"}]},{"dataCells":[{"label":"887057","value":"887057"},{"label":"APJ","value":"APJ"},{"label":"KOREA","value":"KOREA"},{"label":"KOREA","value":"KOREA"},{"label":"KOREA, REPUBLIC OF","value":"KOREA, REPUBLIC OF"},{"label":"KR - KOREA, REPUBLIC OF","value":"KR - KOREA, REPUBLIC OF"},{"label":"PARDO08","value":"005a000000BoAWPAA3"},{"label":"Dong Young Park","value":"Dong Young Park"},{"label":"Shinhan Bank_Service_APIM","value":"006a000001KGLblAAH"},{"label":"SHINHAN FINANCIAL GROUP","value":"0013000000HRMizAAH"},{"label":"USD 21,750.00","value":{"amount":21750.0000067425000020901750006479542502,"currency":"USD"}},{"label":"PARDO08","value":"005a000000BoAWPAA3"},{"label":"Dong Young Park","value":"005a000000BoAWPAA3"},{"label":"Michael Choe","value":"00530000000wtZMAAY"},{"label":"100% - Contract Signed","value":"100% - Contract Signed"},{"label":"Services","value":"Services"},{"label":"API Management","value":"API Management"},{"label":"10/14/2016","value":"2016-10-14"}]},{"dataCells":[{"label":"903580","value":"903580"},{"label":"NA","value":"NA"},{"label":"Named/Growth","value":"Named/Growth"},{"label":"NG_SE","value":"NG_SE"},{"label":"NG_SE_NAMED","value":"NG_SE_NAMED"},{"label":"US - UNITED STATES","value":"US - UNITED STATES"},{"label":"LAKJA04","value":"00530000001qk6DAAQ"},{"label":"James Lake","value":"James Lake"},{"label":"International Paper- SDM Technical Review (Problem Mgmt follow up)","value":"006a000001LM57LAAT"},{"label":"International Paper Company","value":"0013000000HQXsOAAX"},{"label":"USD 21,600.00","value":{"amount":21600,"currency":"USD"}},{"label":"PERPA18","value":"005a000000BCtIeAAL"},{"label":"Paola Perez","value":"005a000000BCtIeAAL"},{"label":"Adam Henrich","value":"005a000000BDEAJAA5"},{"label":"100% - Contract Signed","value":"100% - Contract Signed"},{"label":"Services","value":"Services"},{"label":"Service Management","value":"Service Management"},{"label":"10/12/2016","value":"2016-10-12"}]},{"dataCells":[{"label":"903273","value":"903273"},{"label":"NA","value":"NA"},{"label":"Named/Growth","value":"Named/Growth"},{"label":"NG_NE","value":"NG_NE"},{"label":"NG_NE_NAMED","value":"NG_NE_NAMED"},{"label":"US - UNITED STATES","value":"US - UNITED STATES"},{"label":"HOLJO09","value":"00530000000whNtAAI"},{"label":"John Holovach","value":"John Holovach"},{"label":"Staples - Services Augmentation","value":"006a000001LM2xJAAT"},{"label":"Staples, Inc.","value":"0013000000HQY6PAAX"},{"label":"USD 21,600.00","value":{"amount":21600,"currency":"USD"}},{"label":"HAHDA01","value":"005a000000CQ2i0AAD"},{"label":"Daniel Hahn","value":"005a000000CQ2i0AAD"},{"label":"Michael DiGiovacchino","value":"005300000036QydAAE"},{"label":"100% - Contract Signed","value":"100% - Contract Signed"},{"label":"Services","value":"Services"},{"label":"Security","value":"Security"},{"label":"10/13/2016","value":"2016-10-13"}]},{"dataCells":[{"label":"891000","value":"891000"},{"label":"EMEA","value":"EMEA"},{"label":"UKI","value":"UKI"},{"label":"UKI","value":"UKI"},{"label":"UK","value":"UK"},{"label":"GB - UNITED KINGDOM","value":"GB - UNITED KINGDOM"},{"label":"LESGI01","value":"005a000000B5vDHAAZ"},{"label":"James Leskauskas","value":"James Leskauskas"},{"label":"Sainsbury - EM Governance Report","value":"006a000001KH17BAAT"},{"label":"J SAINSBURY PLC","value":"0013000000Habw5AAB"},{"label":"USD 21,540.00","value":{"amount":21540.00000258480000031017600003722112,"currency":"USD"}},{"label":"PRIMI06","value":"00530000003ozB9AAI"},{"label":"Michael Price","value":"00530000003ozB9AAI"},{"label":"Roy French","value":"00530000003ojkzAAA"},{"label":"100% - Contract Signed","value":"100% - Contract Signed"},{"label":"Services","value":"Services"},{"label":"Enterprise Management","value":"Enterprise Management"},{"label":"10/3/2016","value":"2016-10-03"}]},{"dataCells":[{"label":"900083","value":"900083"},{"label":"APJ","value":"APJ"},{"label":"ANZ","value":"ANZ"},{"label":"AUSTRALIA","value":"AUSTRALIA"},{"label":"AUSTRALIA","value":"AUSTRALIA"},{"label":"AU - AUSTRALIA","value":"AU - AUSTRALIA"},{"label":"BEGAN01","value":"00530000002P1HhAAK"},{"label":"Anthony Beggs","value":"Anthony Beggs"},{"label":"DSFI - PPM Education","value":"006a000001LLUjMAAX"},{"label":"DEPARTMENT OF FINANCE AND SERVICES","value":"00130000014Mdd1AAC"},{"label":"USD 21,439.60","value":{"amount":21439.5999970949342003936364158466622657,"currency":"USD"}},{"label":"BEGAN01","value":"00530000002P1HhAAK"},{"label":"Anthony Beggs","value":"00530000002P1HhAAK"},{"label":"George Yacoub","value":"005a000000Co35WAAR"},{"label":"100% - Contract Signed","value":"100% - Contract Signed"},{"label":"Standalone Education","value":"Standalone Education"},{"label":"PPM","value":"PPM"},{"label":"10/10/2016","value":"2016-10-10"}]},{"dataCells":[{"label":"903329","value":"903329"},{"label":"NA","value":"NA"},{"label":"Public Sector/Canada","value":"Public Sector/Canada"},{"label":"PS_FED/FSI","value":"PS_FED/FSI"},{"label":"PS_DOD/INTEL","value":"PS_DOD/INTEL"},{"label":"US - UNITED STATES","value":"US - UNITED STATES"},{"label":"BATJE03","value":"005a000000Aua7dAAB"},{"label":"Jeffrey Bateman","value":"Jeffrey Bateman"},{"label":"Supplementary Support US TransCom","value":"006a000001LM3zAAAT"},{"label":"UNITED STATES ARMY","value":"0013000000KQZLGAA5"},{"label":"USD 21,347.00","value":{"amount":21347,"currency":"USD"}},{"label":"WAWVI01","value":"00530000004fnCzAAI"},{"label":"Victor W Rie","value":"00530000004fnCzAAI"},{"label":"Mark Mortimer","value":"00530000000whQNAAY"},{"label":"100% - Contract Signed","value":"100% - Contract Signed"},{"label":"Services","value":"Services"},{"label":"N/A","value":"N/A"},{"label":"10/5/2016","value":"2016-10-05"}]},{"dataCells":[{"label":"861149","value":"861149"},{"label":"LA","value":"LA"},{"label":"ANDEAN","value":"ANDEAN"},{"label":"ANDEAN - SOUTH","value":"ANDEAN - SOUTH"},{"label":"PARAGUAY","value":"PARAGUAY"},{"label":"PY - PARAGUAY","value":"PY - PARAGUAY"},{"label":"Gowner","value":"00530000006ca0qAAA"},{"label":"Generic Owner","value":"Generic Owner"},{"label":"Netnix - Millicom - 10 SDM Upgrade / Capacity CA","value":"006a000001IHvDnAAL"},{"label":"Millicom International Cellular SA","value":"001a000001J6b34AAB"},{"label":"USD 20,999.50","value":{"amount":20999.5,"currency":"USD"}},{"label":"MARAD06","value":"005a000000B6XWDAA3"},{"label":"Adriana Marquez Rodriguez","value":"005a000000B6XWDAA3"},{"label":"Rene Osorio","value":"005a000000B5tdrAAB"},{"label":"100% - Contract Signed","value":"100% - Contract Signed"},{"label":"PNCV","value":"PNCV"},{"label":"Automation","value":"Automation"},{"label":"10/4/2016","value":"2016-10-04"}]},{"dataCells":[{"label":"891836","value":"891836"},{"label":"NA","value":"NA"},{"label":"Named/Growth","value":"Named/Growth"},{"label":"NG_NE","value":"NG_NE"},{"label":"NG_NE_NAMED","value":"NG_NE_NAMED"},{"label":"US - UNITED STATES","value":"US - UNITED STATES"},{"label":"Gowner","value":"00530000006ca0qAAA"},{"label":"Generic Owner","value":"Generic Owner"},{"label":"Putnam - AE Upgrade services","value":"006a000000zRcJHAA0"},{"label":"Putnam Investments","value":"0013000000IzcrQAAR"},{"label":"USD 20,400.00","value":{"amount":20400,"currency":"USD"}},{"label":"RUSMO01","value":"00530000000whGrAAI"},{"label":"Monica Russ","value":"00530000000whGrAAI"},{"label":"Corrine Lattell","value":"00530000000wpFSAAY"},{"label":"100% - Contract Signed","value":"100% - Contract Signed"},{"label":"Services","value":"Services"},{"label":"Workload Automation","value":"Workload Automation"},{"label":"10/11/2016","value":"2016-10-11"}]},{"dataCells":[{"label":"717995","value":"717995"},{"label":"NA","value":"NA"},{"label":"Named/Growth","value":"Named/Growth"},{"label":"NG_NE","value":"NG_NE"},{"label":"NG_NE_NAMED","value":"NG_NE_NAMED"},{"label":"US - UNITED STATES","value":"US - UNITED STATES"},{"label":"NA_PARTN","value":"00530000006cIIzAAM"},{"label":"NA PARTNER","value":"NA PARTNER"},{"label":"Supplemental Support - IBM GS-PHH Clarity Services","value":"006a0000019XCdoAAG"},{"label":"IBM Global Services - East (North America)","value":"001a000001J6fgdAAB"},{"label":"USD 20,333.00","value":{"amount":20333,"currency":"USD"}},{"label":"WAWVI01","value":"00530000004fnCzAAI"},{"label":"Victor W Rie","value":"00530000004fnCzAAI"},{"label":"Mark Mortimer","value":"00530000000whQNAAY"},{"label":"100% - Contract Signed","value":"100% - Contract Signed"},{"label":"Services","value":"Services"},{"label":"PPM","value":"PPM"},{"label":"10/6/2016","value":"2016-10-06"}]},{"dataCells":[{"label":"850022","value":"850022"},{"label":"EMEA","value":"EMEA"},{"label":"STH","value":"STH"},{"label":"ISRAEL","value":"ISRAEL"},{"label":"ISRAEL","value":"ISRAEL"},{"label":"IL - ISRAEL","value":"IL - ISRAEL"},{"label":"Gowner","value":"00530000006ca0qAAA"},{"label":"Generic Owner","value":"Generic Owner"},{"label":"NIMSOFT for Tehila(Mimshal Zamin) Via Ness Tech","value":"006a000001HYiblAAD"},{"label":"Government of Israel","value":"0013000000HabuNAAR"},{"label":"USD 19,952.00","value":{"amount":19952,"currency":"USD"}},{"label":"NAKIL02","value":"005a000000C0DdyAAF"},{"label":"Ilan Nakash","value":"005a000000C0DdyAAF"},{"label":"Pierpaolo Taliento","value":"005a0000007oxHMAAY"},{"label":"100% - Contract Signed","value":"100% - Contract Signed"},{"label":"PNCV","value":"PNCV"},{"label":"Enterprise Management","value":"Enterprise Management"},{"label":"10/6/2016","value":"2016-10-06"}]},{"dataCells":[{"label":"884095","value":"884095"},{"label":"EMEA","value":"EMEA"},{"label":"UKI","value":"UKI"},{"label":"UKI","value":"UKI"},{"label":"UK","value":"UK"},{"label":"CH - SWITZERLAND","value":"CH - SWITZERLAND"},{"label":"EKLHE01","value":"00530000000wiEnAAI"},{"label":"Henrik Eklund","value":"Henrik Eklund"},{"label":"IBM - xCom + Datacom workshops","value":"006a000001K3zp0AAB"},{"label":"IBM Global Services (EMEA)- Renewals Only","value":"001a000001J6TE0AAN"},{"label":"USD 19,044.23","value":{"amount":19044.2320022853078402742369408329084329,"currency":"USD"}},{"label":"STECH20","value":"005a000000BEDE5AAP"},{"label":"Chris Steele","value":"005a000000BEDE5AAP"},{"label":"Steve Macfarlane","value":"005300000015fKLAAY"},{"label":"100% - Contract Signed","value":"100% - Contract Signed"},{"label":"Standalone Education","value":"Standalone Education"},{"label":"Mainframe","value":"Mainframe"},{"label":"10/13/2016","value":"2016-10-13"}]},{"dataCells":[{"label":"890542","value":"890542"},{"label":"APJ","value":"APJ"},{"label":"GREATER CHINA","value":"GREATER CHINA"},{"label":"CHINA","value":"CHINA"},{"label":"CHINA","value":"CHINA"},{"label":"CN - CHINA","value":"CN - CHINA"},{"label":"Gowner","value":"00530000006ca0qAAA"},{"label":"Generic Owner","value":"Generic Owner"},{"label":"AirChina-Erwin-CN-NCV","value":"006a000001KGvuPAAT"},{"label":"Air China Limited","value":"001a000001agX9LAAU"},{"label":"USD 18,876.38","value":{"amount":18876.38,"currency":"USD"}},{"label":"YEWER01","value":"005a000000Ck2JUAAZ"},{"label":"Eric Chee Hau Yew","value":"005a000000Ck2JUAAZ"},{"label":"James Anagnostopoulos","value":"00530000004LkK7AAK"},{"label":"100% - Contract Signed","value":"100% - Contract Signed"},{"label":"PNCV","value":"PNCV"},{"label":"Erwin","value":"Erwin"},{"label":"10/4/2016","value":"2016-10-04"}]},{"dataCells":[{"label":"883846","value":"883846"},{"label":"NA","value":"NA"},{"label":"Public Sector/Canada","value":"Public Sector/Canada"},{"label":"PS_CANADA","value":"PS_CANADA"},{"label":"PS_CAN_GROWTH","value":"PS_CAN_GROWTH"},{"label":"CA - CANADA","value":"CA - CANADA"},{"label":"RODED02","value":"005a000000Ck6ixAAB"},{"label":"Edwin Rodriguez","value":"Edwin Rodriguez"},{"label":"EPS: AMS","value":"006a000001K3m5LAAR"},{"label":"City Of Edmonton","value":"0013000000Wo1NZAAZ"},{"label":"USD 18,302.20","value":{"amount":18302.2000004941594000133423038003602422,"currency":"USD"}},{"label":"RODED02","value":"005a000000Ck6ixAAB"},{"label":"Edwin Rodriguez","value":"005a000000Ck6ixAAB"},{"label":"Renee Lalonde","value":"00530000000whN4AAI"},{"label":"100% - Contract Signed","value":"100% - Contract Signed"},{"label":"Services","value":"Services"},{"label":"PPM","value":"PPM"},{"label":"10/6/2016","value":"2016-10-06"}]},{"dataCells":[{"label":"900041","value":"900041"},{"label":"NA","value":"NA"},{"label":"Named/Growth","value":"Named/Growth"},{"label":"NG_NE","value":"NG_NE"},{"label":"NG_NE_NAMED","value":"NG_NE_NAMED"},{"label":"US - UNITED STATES","value":"US - UNITED STATES"},{"label":"Gowner","value":"00530000006ca0qAAA"},{"label":"Generic Owner","value":"Generic Owner"},{"label":"The D&B Maintenance Co-term OL1802556, OL1802545, OL1802593, OL1802595, OL1803084","value":"006a000001LLTP1AAP"},{"label":"The Dun & Bradstreet Corporation","value":"001a000001J6YtqAAF"},{"label":"USD 18,177.52","value":{"amount":18177.52,"currency":"USD"}},{"label":"ROBHO02","value":"005a000000CQqHlAAL"},{"label":"Hope Robillard","value":"005a000000CQqHlAAL"},{"label":"Thomas Knowland","value":"005a000000CQqH2AAL"},{"label":"100% - Contract Signed","value":"100% - Contract Signed"},{"label":"PNCV","value":"PNCV"},{"label":"Erwin","value":"Erwin"},{"label":"10/6/2016","value":"2016-10-06"}]},{"dataCells":[{"label":"898114","value":"898114"},{"label":"EMEA","value":"EMEA"},{"label":"STH","value":"STH"},{"label":"IBERIA","value":"IBERIA"},{"label":"SPAIN","value":"SPAIN"},{"label":"ES - SPAIN","value":"ES - SPAIN"},{"label":"AGUMA02","value":"0053000000488o0AAA"},{"label":"Maria Teresa Aguilar Perez","value":"Maria Teresa Aguilar Perez"},{"label":"Servicios APM","value":"006a000000zOtYiAAK"},{"label":"CAIXABANK","value":"0013000000Hac4hAAB"},{"label":"USD 17,070.00","value":{"amount":17070.0000027994800004591147200752948141,"currency":"USD"}},{"label":"AGUMA02","value":"0053000000488o0AAA"},{"label":"Maria Teresa Aguilar Perez","value":"0053000000488o0AAA"},{"label":"Ricardo Usaola","value":"00530000001bQHzAAM"},{"label":"100% - Contract Signed","value":"100% - Contract Signed"},{"label":"Services","value":"Services"},{"label":"Enterprise Manage